speaker,minute,text
Susan Page,23:26,"… which is about the economy. This has been another aspect of life for Americans, it’s been so affected by this coronavirus. We have a jobs crisis brewing. On Friday, we learned that the unemployment rate had declined to seven point nine percent in September, but the job growth had stalled. And that was before the latest round of layoffs and furloughs in the airline industry, at Disney, and elsewhere. Hundreds of thousands of discouraged workers have stopped looking for work. Nearly 11 million jobs that existed at the beginning of the year haven’t been replaced. Those hardest hit include Latinos, Blacks, and women. Senator Harris, the Biden, Harris campaign has proposed new programs to boost the economy. And you would pay for that new spending by raising four trillion dollars in taxes on wealthy individuals and corporations. Some economists warn that could curb entrepreneurial ventures that fuel growth and create jobs. Would raising taxes put the recovery at risk? And you have two minutes to answer uninterrupted."
Kamala Harris,24:30,"Thank you. On the issue of the economy, I think there couldn’t be a more fundamental difference between Donald Trump and Joe Biden. Joe Biden believes you measure the health and the strength of America’s economy based on the health and the strength of the American worker and the American family. On the other hand, you have Donald Trump who measures the strength of the economy based on how rich people are doing, which is why he passed a tax bill benefiting the top one percent and the biggest corporations of America, leading to a two trillion dollar deficit that the American people are going to have to pay for. On day one, Joe Biden will repeal that tax bill, he’ll get rid of it. And what he’ll do with the money is invest it in the American people."
Kamala Harris,25:17,"And through a plan that is about investing in infrastructure, something that Donald Trump said he would do, I remember hearing about some infrastructure week, I don’t think it ever happened, but Joe Biden will do that. He’ll invest in infrastructure. It’s about upgrading our roads and bridges, but also investing in clean energy and renewable energy. Joe was going to invest that money in what we need to do around innovation. There was a time when our country believed in science and invested in research and development, so that we were an innovation leader on the globe. Joe Biden will use that money to invest in education. So for example, for folks who want to go to a two-year community college, it will be free. If you come from a family that makes less than $125,000, you’ll go to a public university for free. And across the board, we’ll make sure that if you have student loan debt, it’s cut by $10,000."
Kamala Harris,26:09,"That’s how Joe Biden thinks about the economy which is, it’s about investing in the people of our country. As opposed to passing a tax bill, which had the benefit of letting American corporations go off-shore to do their business."
Susan Page,26:24,Thank you Senator Harris.
Kamala Harris,26:25,You’re welcome.
Susan Page,26:26,"Vice President Pence, your administration has been predicting a rapid and robust recovery, but the latest economic report suggests that’s not happening. Should Americans be braced for an economic comeback that is going to take not months, but a year or more? You have two minutes to answer uninterrupted."
Mike Pence,26:43,"When President Trump and I took office, America had gone through the slowest economic recovery since the Great Depression. It was when Joe Biden was vice president, they tried to tax and spend, and regulate, and bail our way back to a growing economy. President Trump cut taxes across the board. Despite what Senator Harris says, the average American family of four had $2,000 in savings in taxes. And with the rise in wages that occurred, most predominantly for blue collar, hardworking Americans, the average household income for a family of four increased by $4,000 following President Trump’s tax cuts. But America, you just heard Senator Harris tell you, on day one, Joe Biden’s going to raise your taxes. It’s really remarkable to think-"
Kamala Harris,27:28,That’s not what I said.
Mike Pence,27:29,"I mean, right after a time where we’re going through a pandemic that lost 22 million jobs at the height, we’ve already added back 11.6 million jobs because we had a president who cut taxes, rolled back regulation, unleashed American energy, fought for free and fair trade and secured four trillion dollars from the Congress of the United States to give direct payments to families, save 50 million jobs through the Paycheck Protection Program. We literally have spared no expense to help the American people and the American worker through this. Joe Biden and Kamala Harris want to raise taxes. They want to bury our economy under a two trillion dollar Green New Deal, which you were one of the original co-sponsors of in the United States Senate. They want to abolish fossil fuels and ban fracking, which would cost hundreds of thousands of Amercian jobs all across the heart land. And Joe Biden wants to go back to the economic surrender to China, that when took office, half of our international trade deficit was with China alone. And Joe Biden wants to repeal all of the tarrifs, that President Trump put into effect to fight for American jobs and American workers. Joe Biden says democracy is on the ballot. Make no mistake about it, Susan. And the American economy, the American comeback is on the ballot with four more years of growth and opportunity."
Susan Page,28:46,Thank you-
Mike Pence,28:47,"… and four more years of president Donald Trump, 2021-"
Susan Page,28:50,"Thank you, Vice President-"
Mike Pence,28:51,… is going to be the biggest economic year in the history of this country.
Susan Page,28:53,"Thank you, Vice President Pence, Senator Harris."
Kamala Harris,28:56,"Well, I mean, I thought we saw enough of it in last week’s debate, but I think this is supposed to be a debate based on fact and truth and the truth and the fact is, Joe Biden has been very clear, he will not raise taxes on anybody who makes less than $400,000 a year."
Mike Pence,29:08,He said he’s going to repeal the Trump tax cuts.
Kamala Harris,29:10,"Mr. Vice President, I’m speaking. I’m speaking."
Mike Pence,29:14,"The important [inaudible] is you said the truth. Joe Biden has said it twice in the debate last week that he’s going to repeal the Trump tax cuts. That was tax cuts that gave the average working family $2,000 in a tax break every single year-"
Kamala Harris,29:28,That is-
Mike Pence,29:28,"Senator, that’s the math."
Kamala Harris,29:30,"That is absolutely not true, [crosstalk 00:00:29:32]."
Mike Pence,29:32,Is he the only going to repeal part of the Trump tax cuts?
Kamala Harris,29:35,"If you don’t mind letting me finish, we can then have a conversation, okay?"
Mike Pence,29:39,Please.
Kamala Harris,29:39,"Okay. Joe Biden will not raise taxes on anyone who makes less than $400,000 a year. He has been very clear about that. Joe Biden will not end fracking, he has been very clear about that. Joe Biden is the one who, during the great recession was responsible for the Recovery Act that brought America back. And now that Trump-"
Kamala Harris,30:03,"… for the Recovery Act that brought America back, and now the Trump-Pence administration wants to take credit when they rode the coattails of Joe Biden’s success for the economy that they had at the beginning of their term. Of course, now the economy is a complete disaster, but Joe Biden on the one hand did that. On the other hand, you have Donald Trump who has reigned over a recession that is being compared to the Great Depression."
Kamala Harris,30:28,"On the one hand, you have Joe Biden who was responsible with President Barack Obama for the Affordable Care Act, which brought healthcare to over 20 million Americans and protected people with preexisting conditions. And what it also did is it saved those families who otherwise were going bankrupt because of hospital bills they could not afford. On the other hand, you have Donald Trump, who is in court right now, trying to get rid of-"
Mike Pence,30:54,"Susan, please [crosstalk 00:30:54]"
Susan Page,30:54,"Thank you, Senator Harris."
Kamala Harris,30:54,"… trying to get rid of the Affordable Care Act, which means that you will lose protections if you have preexisting conditions. And I just, this is very important, Susan. [crosstalk 00:31:03]"
Mike Pence,31:03,"Yes, but we need to give Vice President Pence his time."
Kamala Harris,31:06,"He interrupted me, and I’d like to just finish, please. If you have a preexisting condition, heart disease, diabetes, breast cancer, they’re coming for you. If you love someone who has a pre-existing condition [crosstalk 00:01:21], they’re coming for you. If you are under the age of 26 on your parents’ coverage, they’re coming for you."
Susan Page,31:26,"Senator Harris, thank you."
Kamala Harris,31:28,You’re welcome.
Susan Page,31:28,Let me give you a chance to respond.
Mike Pence,31:29,"Well. I hope we have a chance to talk about healthcare because Obamacare was a disaster, and the American people remember it well. And President Trump and I have a plan to improve healthcare and protect preexisting conditions for every American. But look, Senator Harris, you’re entitled to your own opinion, but you’re not entitled to your own facts. You yourself said on multiple occasions when you were running for president, that you would ban fracking. Joe Biden looked at a supporter in the eye and pointed and said, “I guarantee, I guarantee that we will abolish fossil fuels.”"
Mike Pence,32:06,"They have a $2 trillion version of the Green New Deal, Susan, that your newspaper, USA Today, said really wasn’t that very different from the original Green New Deal. More taxes, more regulation, banning fracking, abolishing fossil fuel, crushing American energy and economic surrender to China is a prescription for economic decline. President Trump and I will keep America growing, the V-shape recovery that’s underway right now will continue with four more years of President Donald Trump [crosstalk 00:32:37]"
Susan Page,32:37,"Thank you very much Vice President Pence. Once again, you’ve provided the perfect segue to a new topic, which is climate change. And Vice President Pence, I’d like to pose the first question to you. This year, we’ve seen record-setting hurricanes in the South. Another one, Hurricane Delta, is now threatening the Gulf, and we have seen record-setting wildfires in the West. Do you believe as the scientific community has concluded, that man-made climate change has made wildfires bigger, hotter, and more deadly and have made hurricanes wetter, slower and more damaging? You have two minutes uninterrupted."
Mike Pence,33:15,"Thank you, Susan. Well, first, I’m very proud of our record on the environment, on conservation. According to all of the best estimates, our air and land are cleaner than any time ever recorded. Our water is among the cleanest in the world. And just a little while ago, the president signed the Outdoors Act. It’s the largest investment in our public lands and public parks in 100 years. So President Trump has made a commitment to conservation and to the environment."
Mike Pence,33:44,"Now with regard to climate change, the climate is changing, but the issue is what’s the cause and what do we do about it? President Trump has made it clear that we’re going to continue to listen to the science. Now Joe Biden and Kamala Harris would put us back in the Paris Climate Accord. They’d impose the Green New Deal, which would crush American energy, would increase the energy costs of American families in their homes, and literally would crush American jobs."
Mike Pence,34:13,"And President Trump and I believe that the progress that we have made in a cleaner environment has been happening precisely because we have a strong, free market economy. What’s remarkable is the United States has reduced CO2 more than the countries that are still in the Paris Climate Accord, but we’ve done it through innovation. And we’ve done it through natural gas and fracking, which Senator, the American people can go look at the record. I know Joe Biden says otherwise now, as you do, but the both of you repeatedly committed to abolishing fossil fuel and banning of fracking."
Mike Pence,34:53,"And so by creating the kind of American innovation, we’re actually steering toward a stronger and better environment. With regard to wildfires, President Trump and I believe that forest management has to be front and center. And even Governor Gavin Newsom from your state has agreed, we’ve got to work on forest management. And with regard to hurricanes, the National Oceanic Administration tells us that actually as difficult as they are, there are no more hurricanes today than there were 100 years ago-"
Susan Page,35:23,Thank you [crosstalk 00:35:24]
Mike Pence,35:24,… but many of the climate alarmists-
Susan Page,35:26,"Vice President Pence, I’m sorry, your time is up."
Mike Pence,35:26,… use hurricanes and wildfires to try and sell the goods of a Green New Deal. And President Trump and I are going to always put-
Susan Page,35:33,"Thank you, Vice President Pence."
Mike Pence,35:34,… American jobs and American workers first.
Susan Page,35:36,"Senator Harris, as the vice president mentioned, you co-sponsored the Green New Deal in Congress, but Vice President Biden said in last week’s debate that he does not support the Green New Deal. But if you look at the Biden-Harris campaign website, it describes the Green New Deal as a crucial framework. What exactly would be the stance of a Biden-Harris administration toward the Green New Deal? You have two minutes uninterrupted."
Kamala Harris,36:02,"So, first of all, I will repeat and the American people know that Joe Biden will not ban fracking. That is a fact. That is a fact. I will repeat that Joe Biden has been very clear that he thinks about growing jobs, which is why he will not increase taxes for anyone who makes less than $400,000 a year. Joe Biden’s economic plan… Moody’s, which is a reputable Wall Street firm, has said will create seven million more jobs than Donald Trump’s."
Kamala Harris,36:38,"And part of those jobs that will be created by Joe Biden are going to be about clean energy and renewable energy. Because, you see, Joe understands that the West Coast of our country is burning, including my home state of California. Joe sees what is happening on the Gulf states, which are being battered by storms. Joe has seen and talked with the farmers in Iowa whose entire crops have been destroyed because of floods."
Kamala Harris,37:07,"And so Joe believes, again, in science. I’ll tell you something, Susan, I served when I first got to the Senate on the committee that’s responsible for the environment. Do you know, this administration took the word science off the website, and then took the phrase climate change off the website? We have seen a pattern with this administration, which is they don’t believe in science. And Joe’s plan is about saying we’re going to deal with it, but we’re also going to create jobs. Donald Trump, when asked about the wildfires in California, and the question was, the science is telling us this… You know what Donald Trump said? Science doesn’t know."
Kamala Harris,37:43,"So let’s talk about who is prepared to lead our country over the course of the next four years on what is an existential threat to us as human beings. Joe is about saying we’re going to invest that in renewable energy, which is going to be about the creation of millions of jobs. We will achieve net zero emissions by 2050, carbon neutral by 2035. Joe has a plan. This has been a lot of talk from the Trump administration, and really it has been to go backward instead of forward. We will also reenter the Climate Agreement with pride."
Susan Page,38:16,"Senator Harris just said that climate change is an existential threat. Vice President Pence, do you believe that climate change poses an existential threat?"
Mike Pence,02:09,"As I said, Susan, the climate is changing. We’ll follow the science. But once again, Senator Harris is denying the fact that they’re going to raise taxes on every American. Joe Biden said twice in the debate last week, that on day one, he was going to repeal the Trump tax cuts. Those tax cuts delivered $2,000 in tax relief to the average family of four across America. And with regard to banning fracking, I just recommend that people look at the record. You yourself said repeatedly that you would ban fracking. You were the first Senate co-sponsor of the Green New Deal. And while Joe Biden denied the green new deal, Susan, thank you for pointing out. The Green New Deal is on their campaign website."
Mike Pence,02:54,"And as USA TODAY said, it’s essentially the same plan as you co-sponsored with AOC when she submitted it in the Senate. And you just heard the Senator say that she’s going to resubmit America to the Paris climate accord. Look, the American people have always cherished our environment and will continue to cherish it. We’ve made great progress reducing CO2 emissions through American innovation and the development of natural gas through fracking. We don’t need a massive $2 trillion Green New Deal that would impose all new mandates on American businesses and American families."
Susan Page,03:30,Thank you.
Mike Pence,03:30,Joe Biden wants us to retrofit-
Susan Page,03:32,Thank you Vice President Pence.
Mike Pence,03:32,Four million business-
Susan Page,03:34,Thank you Vice President Pence.
Mike Pence,03:35,Buildings. It makes no sense. It will cost jobs. President Trump-
Susan Page,03:39,Thank you Vice President Pence.
Mike Pence,03:40,He’s going to put America first. He’s going to put jobs first and we’re going to take care of our environment and follow the science.
Susan Page,03:45,Thank you Vice President-
Kamala Harris ,03:46,"Well, on the issue of jobs."
Susan Page,03:47,Senator Harris.
Kamala Harris ,03:47,"Let’s talk about that. The vice-president earlier referred to it as part of what he thinks is an accomplishment. The president’s trade war with China. You lost that trade war. You lost it. What ended up happening is because of a so-called trade war with China, America lost 300,000 manufacturing jobs. Farmers have experienced bankruptcy because of it. We are in a manufacturing recession because of it. And when we look at where this administration has been, there are estimates that by the end of the term of this administration, they will have lost more jobs than almost any other presidential administration and the American people know what I’m talking about."
Kamala Harris ,04:39,"I think about 20 year olds, we have a 20 something year old who are coming out of high school and college right now. And you’re wondering, is there going to be a job there for me? We’re looking at people who are trying to figure out how they’re going to pay rent by the end of the month, almost half of American renters are worried about whether they’re going to be able to pay rent by the end of the month. This is where the economy is in America right now. And it is because of the catastrophe and the failure of leadership of this administration."
Susan Page,05:14,"Thank you Senator Harris. Vice President Pence, let me give you just 15 seconds to respond because then I want to move on."
Mike Pence,05:18,"Well, I’d love to respond. Look, lost the trade war with China? Joe Biden never fought it. Joe Biden has been a cheerleader for communist China over the last several decades. And again, Senator Harris, you’re entitled to your opinion. You’re not entitled to your own facts. When Joe Biden was vice-president, we lost 200,000 manufacturing jobs. And president Obama said they were never coming back. He said, we needed a magic wand to bring them back. In our first three years after we cut taxes-"
Susan Page,05:48,Thank you Vice President Pence.
Mike Pence,05:50,"Roll back regulation, unleashed American energy. This administration saw 500,000 manufacturing-"
Susan Page,05:54,Thank you Vice President Pence.
Mike Pence,05:54,"Jobs created, and that’s exactly the kind of growth we’re going to continue to see as we bring our nation through-"
Susan Page,06:00,Thank you Vice President Pence.
Mike Pence,06:00,This pandemic.
Kamala Harris ,06:00,Listen-
Mike Pence,06:02,A Green New Deal-
Susan Page,06:02,Thank you Vice President Pence.
Mike Pence,06:02,"You’re passing new mandates, your Paris Climate Accord. It’s going to kill jobs this time, just like it killed jobs-"
Kamala Harris ,06:08,I just need to respond very quickly.
Mike Pence,06:10,15 seconds.
Kamala Harris ,06:11,Thank you-
Mike Pence,06:11,And then we move on.
Kamala Harris ,06:11,Thank you. Joe Biden is responsible for saving America’s auto industry and you voted against it. So let’s set the record straight. Thank you.
Susan Page,06:23,"I’d like to talk about China. We have as our next topic, we have no more complicated or consequential foreign relationship than the one with China. It is a huge market for American agricultural goods. It’s a potential partner in dealing with climate change in North Korea and in a video tonight, President Trump again, blamed it for the Coronavirus saying China will pay. Vice President Pence, how would you describe our fundamental relationship with China? Competitors? Adversaries? Enemies? You have two minutes."
Mike Pence,06:57,"Thank you, Susan. Well, before I leave that, let me speak to voting records if I can. Everybody knows that NAFTA costs literally thousands of American factories to close. We saw automotive jobs go South of the border. President Trump fought to renegotiate NAFTA. In the United States, Mexico and Canada the agreement is now the law of the land. American people deserve to know Senator Kamala Harris was one of only 10 members of the Senate to vote against the USMCA. It was a huge win for American auto workers. It was a huge win for American farmers, especially dairy in the upper Midwest. But Senator you said it didn’t go far enough on climate change, you put your radical environmental agenda ahead of American auto workers and a head of American jobs. I think the American people deserve to know that it’s probably why Newsweek magazine said that Kamala Harris was the most liberal member of the United States Senate in 2019, more liberal than Bernie Sanders, more liberal than any of the others in the United States Senate."
Mike Pence,08:06,"So now with regard to China, Susan first and foremost, China is to blame for the coronavirus and President Trump is not happy about it. He’s made that very clear, made it clear again today that China and the world health organization did not play straight with the American people. They did not let our personnel into China to get information on the Coronavirus until the middle of February. Fortunately, President Trump in dealing with China from the outset of this administration, standing up to China that had been taking advantage of America for decades in the wake of Joe Biden’s cheerleading for China. President Trump made that decision before the end of January to suspend all travel from China. And again, the American people deserve to know Joe Biden opposed President Trump’s decision to suspend all travel from China. He said it was hysterical. He said it was-"
Susan Page,09:00,Thank you Vice President Pence.
Mike Pence,09:02,The President Trump has stood up-
Susan Page,09:03,"Vice President Pence, your time is up."
Mike Pence,09:04,To China. We’re going to continue to stand strong.
Susan Page,09:06,Thank you Vice President Pence.
Mike Pence,09:07,"We want to improve the relationship, but we’re going to level the playing field and we’re going to hold China accountable-"
Susan Page,09:12,Vice President Pence.
Mike Pence,09:12,for what they did to America with the coronavirus.
Susan Page,09:13,"Thank you. Senator Harris, let me ask you the same question that I asked the vice-president. How would you describe our fundamental relationship with China? Are we competitors? Adversaries? Enemies? You’ll have two minutes uninterrupted."
Kamala Harris ,09:29,"Susan, the Trump administration’s perspective and approach to China has resulted in the loss of American lives, American jobs, and America’s standing. There is a weird obsession that President Trump has had with getting rid of whatever accomplishment was achieved by President Obama and Vice President Biden. For example, they created within the White House and office that basically was responsible for monitoring pandemics. They got rid of it."
Mike Pence,10:09,Not true.
