speaker,minute,text
Mike Pence,35:27,"And I must tell you, this presumption that you hear consistently from Joe Biden and Kamala Harris, that America is systemically racist, and that as Joe Biden said that he believes that law enforcement has an implicit bias against minorities is a great insult to the men and women who serve in law enforcement. And I want everyone to know who puts on the uniform of law enforcement every day, President Trump and I stand with you. And it is remarkable that when Senator Tim Scott tried to pass a police reform bill, brought together a group of Republicans and Democrats, Senator Harris, you got up and walked out of the room and then you filibustered Senator Tim Scott’s bill on the Senate floor that would have provided new accountability, new repeat resources. We don’t have to choose between supporting law enforcement, proving public safety and supporting our African-American neighbors and all of our minorities. Under President Trump’s leadership-"
Susan Page,36:33,"Thank you, Vice President."
Mike Pence,36:33,We’ll always stand with law enforcement and we’ll do what we’ve done-
Susan Page,36:36,"Vice President Pence, thank you. Your time is up."
Mike Pence,36:38,"From day one, it is improve the lives of African-Americans, record unemployment, record investments in education."
Susan Page,36:43,"Thank you, Vice President Pence. Vice President Pence, your time is up."
Mike Pence,36:44,We’ll fight for school choice for all of [crosstalk 00:36:46].
Kamala Harris ,36:46,I’d like to respond.
Susan Page,36:48,Senator Harris.
Kamala Harris ,36:49,"I will not sit here and be lectured by the Vice President on what it means to enforce the laws of our country. The only one on this stage, who has personally prosecuted everything from child sexual assault to homicide. I’m the only one on this stage who has prosecuted the big banks for taking advantage of America’s homeowners. I am the only one on this stage who prosecuted for-profit colleges for taking advantage of our veterans."
Kamala Harris ,37:16,And the reality of this is that we are talking about an election in 27 days where last week the President of the United States took a debate stage in front of 70 million Americans and refused to condemn white supremacists.
Mike Pence,37:31,Not. Not true.
Kamala Harris ,37:32,"And it wasn’t like he didn’t have a chance. He didn’t do it. And then he doubled down. And then he said, “when pressed, stand back, stand by.” And this is a part of a pattern of Donald Trump’s. He called Mexicans rapists and criminals. He instituted as his first act, a Muslim ban. He on the issue of Charlottesville, where people were peacefully protesting the need for racial justice, where a young woman was killed. And on the other side, there were neo-Nazis carrying Tiki torches, shouting racial epithets, anti-Semitic slurs. And Donald Trump when asked about it said, “There were fine people on both sides.” This is who we have as the President of the United States and America, you deserve better. Joe Biden will be a president who brings our country together-"
Susan Page,38:38,Senator Harris.
Kamala Harris ,38:39,And recognizes the beauty in our diversity and the fact that we all have so much more in common than what separates us.
Susan Page,38:46,Vice President let me give you a minute to respond.
Mike Pence,38:49,"Thank you, Susan. I appreciate that very much. I think this is one of the things that makes people dislike the media so much in this country, Susan, is that you selectively edit just like Senator Harris did, comments that President Trump and I and others on our side made. I mean, Senator Harris conveniently admitted after the President made comments about people on either side of the debate over monuments, he condemned the KKK, neo-Nazis and white supremacists and has done so repeatedly. You’re concerned that he doesn’t condemn neo-Nazis. President Trump has Jewish grandchildren. His daughter and son-in-law are Jewish. This is a President who respects and cherishes all of the American people."
Mike Pence,39:37,"But you talk about having personally prosecuted. I’m glad you brought up your record, Senator."
Susan Page,39:40,Thank you.
Mike Pence,39:42,"I really need to make this point. When you were DA in San Francisco, when you left office, African-Americans were 19 times more likely to be prosecuted for minor drug offenses than whites and Hispanics. When you were Attorney General of California, you increased the disproportionate incarceration of blacks in California."
Susan Page,40:04,Thank you.
Mike Pence,40:04,"You did nothing on criminal justice reform in California. You didn’t lift a finger to pass the first step back on Capitol Hill. I mean, the reality is your record speaks for itself."
Susan Page,40:15,Thank you Vice President.
Mike Pence,40:15,President Trump and I have fought for criminal justice before-
Susan Page,40:18,Thank you Vice President.
Mike Pence,40:19,We fought for educational choice and opportunities for African-Americans and all of our members.
Susan Page,40:23,"Thank you, sir."
Mike Pence,40:24,And we’ll do it for four more years.
Susan Page,40:25,Thank you. There is no more important issue than the final issue that we’re going to talk about tonight and that is the issue of the election itself.
Kamala Harris ,40:33,But he attacked my record. I would like an opportunity to respond to.
Susan Page,40:35,Let me give you 30 seconds because we’re running out of time.
Kamala Harris ,40:39,"I appreciate that. First of all, having served as the Attorney General of the state of California, the work that I did is a model of what our nation needs to do, and we will be able to do under a Joe Biden presidency. Our agenda includes what this administration has failed to do. It will be about not only instituting a ban on choke holes and carotid holes-"
Susan Page,41:06,Thank you. Thank you Senator Harris.
Kamala Harris ,41:07,I would like to go through-
Susan Page,41:09,These are points that you made earlier in the hour. And I want to talk about the election itself before we have to [crosstalk 00:41:13].
Kamala Harris ,41:13,"But I want to talk about the connection between what Joe and I will do in my record, which includes I was the first statewide officer to institute a requirement that my agents would wear body cameras and keep them on full-time. We were the first to initiate a requirement that there would be a training for law enforcement on implicit bias because yes, Joe Biden and I recognize that implicit bias does exist, Mr. Vice President, contrary to what you may believe. We did the work of instituting reforms that were about investing in re-entry. This is the work that we have done and the work we will do going forward. And again, I will not be lectured by the Vice President on our record of what we have done in terms of law enforcement and keeping our community safe and a commitment to reforming the criminal justice system of America."
Susan Page,42:03,"Thank you, Senator-"
Kamala Harris ,42:03,And a commitment to reforming the criminal justice system of America.
Susan Page,42:03,"Thank you, Senator Harris. And I’d like you to respond first to the question on our final topic, the election itself. President Trump has several times refused to commit himself to a peaceful transfer of power after the election. If your ticket wins and president Trump refuses to accept a peaceful transfer of power, what steps would you and vice president Biden then take? What would happen next? You have two minutes."
Kamala Harris ,42:31,"So I’ll tell you. Joe and I are particularly proud of the coalition that we’ve built around our campaign. We probably have one of the broadest coalitions of folks that you’ve ever seen in a presidential race. Of course, we have the support of Democrats, but also independents and Republicans. In fact, seven members of president George W. Bush’s cabinet are supporting our ticket. We have the support of Colin Powell, Cindy McCain, John Kasich. Over 500 generals, retired generals and former national security experts and advisors are supporting our campaign. And I believe they are doing that because they know that Joe Biden has a deep, deep seated commitment to fight for our democracy, and to fight for the integrity of our democracy, and to bring integrity back to the White House. We believe in the American people, we believe in our democracy, and here’s what I’d like to say to everybody. Vote, please vote, vote early, come up with a plan to vote, go to Iwillvote.com. You can also go to Joebiden.com."
Kamala Harris ,43:44,"We have it within our power in these next 27 days to make the decision about what will be the course of our country for the next four years. And it is within our power, and if we use our vote and we use our voice, we will win. And we will not let anyone subvert our democracy with what Donald Trump has been doing as he did on the debate stage last week, when, again, in front of 70 million people, he openly attempted to suppress the vote. Joe Biden, on the other hand, on that same debate stage, because clearly Donald Trump doesn’t think he can run on a record because it’s a failed record, Joe Biden on that stage said, Hey, just please vote. So I’ll repeat what Joe said. Please vote."
Susan Page,44:31,"Thank you, Senator. Vice president Pence, president Trump has several times refused to commit himself to a peaceful transfer of power after the election. If vice president Biden is declared the winner and president Trump refuses to accept a peaceful transfer of power, what would be your role and responsibility as vice president? What would you personally do? You have two minutes."
Mike Pence,44:55,"Well, Susan, first and foremost, I think we’re going to win this election. Because while Joe Biden and Kamala Harris rattle off a long litany of the establishment in Washington, DC and establishment that Joe Biden’s been a part of for 47 years, president Donald Trump has as launched a movement of everyday Americans from every walk of life. And I have every confidence that the same Americans that delivered that historic victory in 2016, they see this president’s record where we rebuild our military. We revived our economy through tax cuts and rolling back regulation, fighting for fair trade, unleashing American energy. We appointed conservatives to our federal courts at every level. And we stood with the men and women of law enforcement every single day. And I think that movement of Americans has only grown stronger in the last four years."
Mike Pence,45:44,"But when you talk about accepting the outcome of the election, I must tell you. Senator, your party has spent the last three and a half years trying to overturn the results of the last election. It’s amazing. When Joe Biden was vice president of the United States, the FBI actually spied on president Trump and my campaign. I mean, there were documents released this week that the CIA actually made a referral to the FBI, documenting that those allegations were coming from the Hillary Clinton campaign. And of course, we’ve all seen the avalanche, what you put the country through for the better part of three years, until it was found that there was no obstruction, no collusion, case closed. And then Senator Harris, you and your colleagues in the Congress tried to impeach the president of the United States over a phone call. And now Hillary Clinton has actually said to Joe Biden that, in her words, under no circumstances, should he concede the election."
Mike Pence,46:46,"So let me just say, I think we’re going to win this election. President Trump and I are fighting every day in courthouses to prevent Joe Biden and Kamala Harris from changing the rules and creating this universal mail in voting that’ll create a massive opportunity for voter fraud. And we have a free and fair election. We know we’re going to have confidence in it. And I believe in all my heart that president Donald Trump is going to be reelected for four more years."
Susan Page,47:09,"I’ve written all the questions that I’ve asked tonight, but for the final question of the debate, I’d like to read a question that someone else wrote. The Utah Debate Commission asked students in the state to write essays about what they would like to ask you. And I want to close tonight’s debate with the question posed by Brecklin Brown. She’s an eighth grader at Springville Junior High in Springville, Utah. And here’s what she wrote. “When I watch the news, all I see is arguing between Democrats and Republicans. When I watch the news, all I see is citizen fighting against citizen. When I watch the news, all I see are two candidates from opposing parties trying to tear each other down. If our leaders can’t get along, how are the citizens supposed to get along?” And then she added, “Your examples could make all the difference to bring us together.” So to each of you in turn, I’d like you to take one minute and respond to Brecklin. Vice president Pence, you have one minute."
Mike Pence,48:13,"Brecklin, it’s a wonderful question. And let me just commend you for taking an interest in public life. I started following the news when I was very young. And in America, we believe in a free and open exchange of debate. And we celebrate that. It’s how we’ve created literally the freest and most prosperous nation in the history of the world. I would tell you that, don’t assume that what you’re seeing on your local news networks is synonymous with the American people."
Mike Pence,48:53,"I look at the relationship between Justice Ruth Bader Ginsberg, the late justice who we just lost from the Supreme Court, and the late justice Antonin Scalia. They were on polar opposites on the Supreme Court of the United States. One very liberal one, very conservative. But what’s been learned since her passing was the two of them and their families were the very closest of friends. Here in America, we can disagree. We can debate vigorously as Senator Harris and I have on this stage tonight. But when the debate is over, we come together as Americans. And that’s what people do, in big cities and small towns all across this country. So I just want to encourage you, Brecklin. I want to tell you that we’re going to work every day to have government as good as our people, and the American people each and every day. Love a good debate. We love a good argument. But we always come together and are always there for one another in times of need. And we’ve especially learned that through the difficulties of this year."
Susan Page,49:51,"Thank you, vice president. Senator Harris, what would you say to Brecklin?"
Kamala Harris ,49:58,"First of all, I love hearing from our young leaders. And when I hear her words, when I hear your words, Brecklin, I know our future is bright because it is that perspective on who we are and who we should be that is a sign of leadership, and is something we should all aspire to be."
Kamala Harris ,50:17,"And brings me to Joe, Joe Biden. One of the reasons that Joe decided to run for president is after Charlottesville, which we talked about earlier. It so troubled him and upset him like it did all of us, that there was that kind of hate and division. What propelled Joe to run for president was to see that over the course of the last four years, what Brecklin described has been happening."
Kamala Harris ,50:44,"Joe has a longstanding reputation of working across the aisle, and working in a bipartisan way. And that’s what he’s going to do as president. Joe Biden has a history of lifting people up and fighting for their dignity. You have to know Joe’s story to know that Joe has known pain. He has known suffering. And he has known love."
Kamala Harris ,51:10,"Brecklin, when you think about the future, I do believe the future is bright. And it will be because of your leadership, and it will be because we fight for each person’s voice through their vote. And we get engaged in this election, because you have the ability through your work and through, eventually, your vote, to determine the future of our country and what its leadership looks like."
Susan Page,51:37,"Thank you, Senator Harris. Thank you, vice president Pence. Thank you so much for being with us tonight."
Susan Page,51:42,"We want to thank also the University of Utah for its hospitality. And most of all, our thanks to all the Americans who watched this debate tonight. Again, our best wishes for a quick recovery to president Trump, the First Lady, and everyone who is battling COVID-19. The second presidential debate is next week on October 15, a town hall style debate in Miami. We hope you’ll join us then. Good evening."
