speaker,minute,text
Susan Page,00:00,"Good evening. From the University of Utah in Salt Lake City, welcome to the first and only vice presidential debate of 2020 sponsored by the nonpartisan commission on presidential debates. I’m Susan Page of USA Today. It is my honor to moderate this debate, an important part of our democracy. In Kingsbury Hall tonight, we have a small and socially distant audience and we’ve taken extra precautions during this pandemic. Among other things, everyone in this audience is required to wear a face mask and the candidates will be seated 12 feet apart. The audience is enthusiastic about their candidates, but they’ve agreed to express that enthusiasm only twice—at the end of the debate and now, when I introduce the candidates. California Senator Kamala Harris and Vice President Mike Pence. Senator Harris and Vice President Pence, thank you for being here. We’re meeting as President Trump and the First Lady continue to undergo treatment in Washington, after testing positive for COVID-19. We send our thoughts and prayers to them for their rapid and complete recovery, and for the recovery of everyone afflicted by the coronavirus. The two campaigns and the commission on presidential debates agreed to the ground rules for tonight. I’m here to enforce them.On behalf of the millions of Americans who are watching. One note: no one in either campaign or at the commission or anywhere else has been told in advance what topics I’ll raise or what questions I’ll ask. This 90 minute debate will be divided into nine segments of about 10 minutes each. I’ll begin a segment by posing a question to each of you. Sometimes the same question, sometimes a different question on the same topic. You will then have two minutes to answer without interruption by me or the other candidate. Then we’ll take six minutes or so to discuss the issue. At that point, although there will always be more to say, we’ll move on to the next topic. We want a debate that is lively, but Americans also deserve a discussion that is civil."
Susan Page,01:21,"These are tumultuous times, but we can and will have a respectful exchange about the big issues facing our nation. Let’s begin with the ongoing pandemic that has cost our country so much. Senator Harris, the coronavirus is not under control. Over the past week, Johns Hopkins reports that 39 states have had more COVID cases over the past seven days than in the week before. Nine States have set new records. Even if a vaccine is released soon, the next administration will face hard choices. What would a Biden administration do in January and February that a Trump administration wouldn’t do? Would you impose new lockdowns for businesses and schools and hotspots, a federal mandate to wear masks? You have two minutes to respond without interruption."
Kamala Harris,02:13,"Thank you, Susan. Well, the American people have witnessed what is the greatest failure of any presidential administration in the history of our country. And here are the facts. 210,000 dead people in our country in just the last several months. Over 7 million people who have contracted this disease. One in five businesses closed. We’re looking at frontline workers who have been treated like sacrificial workers. We are looking at over 30 million people, who in the last several months, had to file for unemployment. And here’s the thing, on January 28th, the vice president and the president were informed about the nature of this pandemic. They were informed that it’s lethal in consequence, that it is airborne, that it will affect young people, and that it would be contracted because it is airborne. And they knew what was happening, and they didn’t tell you."
Kamala Harris,03:21,"Can you imagine if you knew on January 28th, as opposed to March 13th, what they knew, what you might’ve done to prepare? They knew, and they covered it up. The president said it was a hoax. They minimized the seriousness of it. The president said, “You’re on one side of his ledger if you wear a mask. You’re on the other side of his ledger if you don’t.” And in spite of all of that, today, they still don’t have a plan. They still don’t have a plan. Well, Joe Biden does. And our plan is about what we need to do around a national strategy for contact tracing, for testing, for administration of the vaccine, and making sure that it will be free for all. That is the plan that Joe Biden has and that I have, knowing that we have to get a hold of what has been going on, and we need to save our country. And Joe Biden is the best leader to do that. And frankly, this administration has forfeited their-"
Susan Page,04:17,"Thank you, Senator Harris-"
Kamala Harris,04:18,… right to reelection based on this.
Susan Page,04:20,"Thank you, Senator Harris. Vice President Pence, more than 210,000 Americans have died of COVID-19 since February. The US death toll, as a percentage of our population, is higher than that of almost every other wealthy nation on Earth. For instance, our death rate is two and a half times that of Canada, next door. You had the administration’s coronavirus task force. Why is the US death toll, as a percentage of our population, higher than that of almost every other wealthy country? And you have two minutes to respond without interruption."
Mike Pence,04:55,"Susan, thank you. And I want to thank the Commission and the University of Utah for hosting this event. And Senator Harris, it’s a privilege to be on the stage with you. And our nation has gone through a very challenging time this year. But I want the American people to know that from the very first day, President Donald Trump has put the health of America first. Before there were more than five cases in the United States, all people who had returned from China, President Donald Trump did what no other American president had ever done. And that was, he suspended all travel from China, the second largest economy in the world. Now, Senator Joe Biden opposed that decision. He said it was xenophobic and hysterical. But I can tell you having led the white house coronavirus task force that that decision alone by President Trump bought us invaluable time to stand up the greatest national mobilization since World War Two."
Mike Pence,05:57,"And I believe it saved hundreds of thousands of American lives. Because with that time, we were able to reinvent testing. More than 115 million tests had been done to date. We were able to see to the delivery of billions of supplies, so our doctors and nurses had the resources support they needed. And we began, really, before the month of February we started to develop a vaccine and to develop medicines and therapeutics that have been saving lives all along the way. And under President Trump’s leadership, Operation Warp Speed, we believe we’ll have literally tens of millions of doses of a vaccine before the end of this year. The reality is, when you look at the Biden plan, it reads an awful lot like what President Trump, and I, and our task force has been doing every step of the way. And quite frankly, when I look at their plan that talks about advancing testing, creating new PPE, developing a vaccine, it looks a little bit like plagiarism, which is something Joe Biden knows a little bit about. And I think the American people know that this is a president who has put the health-"
Susan Page,06:59,"Thank you, Vice President Pence-"
Mike Pence,06:59,"… of America first. And the American people, I believe with my heart, can be proud-"
Susan Page,07:03,"Thank you, Vice President Pence-"
Mike Pence,07:04,… of the sacrifices they have made. It’s saved countless American lives-
Susan Page,07:07,"Thank you, Vice President Pence. Senator Harris, would you like to respond?"
Kamala Harris,07:10,"Absolutely. Whatever the vice president is claiming the administration has done, clearly, it hasn’t worked. When you’re looking at over 210,000 dead bodies in our country, American lives that have been lost, families that are grieving that loss, and the vice president is the head of the task force and knew on January 28th, how serious this was. And then, thanks to Bob Woodward, we learned that they knew about it. And then when that was exposed, the vice president said, when asked, “Well, why didn’t you all tell anybody?” He said, “Because the president wanted people to remain calm.”"
Susan Page,07:52,"Well, let’s [crosstalk 00:07:53]-"
Kamala Harris,07:53,"No. But Susan, this is important. And I want to add-"
Mike Pence,07:55,"Susan, I have to weigh in here-"
Kamala Harris,07:56,"Mr. Vice President, I’m speaking."
Mike Pence,07:57,I have to weigh in.
Kamala Harris,07:58,I’m speaking.
Susan Page,07:59,"You can have 15 more seconds, and then we’ll give the vice-president a chance to respond-"
Kamala Harris,08:02,"Thank you. So I want to ask the American people, how calm were you when you were panicked about where you were going to get your next roll of toilet paper? How calm were you when your kids were sent home from school and you didn’t know when they could go back? How calm were you-"
Susan Page,08:15,Thank you-
Kamala Harris,08:15,… when your children-
Susan Page,08:16,"Thank you, Senator Harris-"
Kamala Harris,08:18,… couldn’t see your parents because you were afraid they could kill them.
Susan Page,08:20,"Let’s give Vice President Pence a chance to respond. Vice President Pence, you have one minute to respond."
Mike Pence,08:23,"There’s not a day gone by that I haven’t thought of every American family that’s lost a loved one. And I want all of you to know that you’ll always be in our hearts and in our prayers. But when you say what the American people have done over these last eight months, hasn’t worked, that’s a great disservice to the sacrifices the American people have made-"
Kamala Harris,08:44,I’m referring to the president-
Mike Pence,08:45,"But the reality… If I may finish, Senator. The reality is Dr. Fauci said everything that he told the president in the Oval Office, the president told the American. Now President Trump, I will tell you, has boundless confidence in the American people, and he always spoke with confidence that we’d get through this together. But when you say it hasn’t worked… When Dr. Fauci, and Dr. Birx, and our medical experts came to us in the second week of March, they said, if the president didn’t take the unprecedented step of shutting down roughly half of the American economy, that we could lose 2.2 million Americans. That’s the reality."
Susan Page,09:22,"Thank you. Thank you, Vice President Pence-"
Mike Pence,09:22,"They also said to us, if we did everything right, Susan, we could still lose more than 200,000 Americans."
Susan Page,09:27,Vice President Pence-
Mike Pence,09:28,"One life lost is too many, Susan. But the American people, I believe, deserve credit for the sacrifices that they have made, putting the health of their family and their neighbors first, our doctors, our nurses, our first responders."
Susan Page,09:41,"Thank you, Vice President Pence."
Mike Pence,09:42,And I’m going to speak up on behalf of what the American people have done.
Susan Page,09:45,"Vice President Pence, you were in the front row in a Rose Garden event 11 days ago, at what seems to have been a super spreader event for senior administration and congressional officials. No social distancing, few masks, and now a cluster of coronavirus cases among those who were there. How can you expect Americans to follow the administration…"
Susan Page,10:03,How can you expect Americans to follow the administration’s safety guidelines to protect themselves from COVID when you at the White House have not been doing so?
Mike Pence,10:11,"Well, the American people have demonstrated over the last eight months, that when given the facts, they’re willing to put the health of their families and their neighbors and people they don’t even know first. President Trump and I have great confidence in the American people and their ability to take that information and put it into practice. In the height of the epidemic when we were losing a heartbreaking number of 2,500 Americans a day, we surged resources to New Jersey and New York and New Orleans and Detroit. We told the American people what needed to be done, and the American people made the sacrifices. When the outbreak in the Sun Belt happened this summer, again, Americans stepped forward. But the reality is the work of the President of the United States goes on. A vacancy on the Supreme Court of the United States has come upon us, and the President introduced Judge Amy Coney Barrett."
Susan Page,11:05,"Yes, thank you. Thank you, Vice President."
Mike Pence,11:07,"If I may say, that Rose Garden event, been a great deal of speculation about it. My wife, Karen and I were there and honored to be there. Many of the people who were at that event, Susan, actually were tested for Coronavirus, and it was an outdoor event, which all of our scientists regularly and routinely advise. The difference here is President Trump and I trust the American people to make choices in the best interest of their health. Joe Biden and Kamala Harris consistently talk about mandates, and not just mandates with the Coronavirus, but a government takeover of healthcare, the Green New Deal, all government control. We’re about freedom and respecting the freedom of the American people."
Kamala Harris,11:48,Let’s talk about respecting the American people. You respect the American people when you tell them the truth. You respect the American people when you have the courage to be a leader.
Mike Pence,11:58,Which we’ve always done.
Kamala Harris,11:58,"Speaking of those things that you may not want people to hear, but they need to hear so they can protect themselves. But this administration stood on information that, if you had as a parent, if you had as a worker, knowing you didn’t have enough money saved up, and now you’re standing in a food line because of the ineptitude of a administration that was unwilling to speak the truth to the American people. So let’s talk about caring about the American people. The American people have had to sacrifice far too much because of the incompetence of this administration. It is asking too much of the people-"
Mike Pence,12:33,"Susan, we talked about this."
Kamala Harris,12:34,It is asking too much of the people. That they would not be equipped with the information they need to help themselves to protect their parents and their children.
Susan Page,12:42,"I’m sorry. Kamala Harris, Senator Harris, I mean, I’m sorry."
Kamala Harris,12:46,"That’s fine, I’m Kamala."
Susan Page,12:47,"No, no, you’re Senator Harris to me. For life to get back to normal, Dr. Anthony Fauci and other experts say that most of the people who can be vaccinated need to be vaccinated. But half of Americans now say they wouldn’t take a vaccine if it was released now. If the Trump administration approves a vaccine before or after the election, should Americans take it, and would you take it?"
Kamala Harris,13:11,"If the public health professionals, if Dr. Fauci, if the doctors tell us that we should take it, I’ll be the first in line to take it, absolutely. But if Donald Trump tells us that we should take it, I’m not taking it."
Susan Page,13:24,"Vice President Pence, there’ve been a lot of repercussions from this pandemic. In recent days, the President’s diagnosis of COVID-19 has underscored the importance of the job that you hold and that you are seeking. That’s our second topic tonight. It’s the role of the Vice President. One of you will make history on January 20th. You will be the Vice President to the oldest President the United States has ever had. Donald Trump will be 74 years old on inauguration day. Joe Biden will be 78 years old. That already has raised concerns among some voters, concerns that have been sharpened by President Trump’s hospitalization in recent days. Vice President Pence, have you had a conversation or reached an agreement with President Trump about safeguards or procedures when it comes to the issue of presidential disability? And if not, do you think you should? You have two minutes without interruption."
Mike Pence,14:20,"Well, Susan, thank you. Although, I would like to go back."
Susan Page,14:23,I think we need to move on to the issue of vice presidency.
Mike Pence,14:28,"Well, thank you, but I would like to go back because the reality is that we’re going to have a vaccine, Senator, in record time. In unheard of time, in less than a year. We have five companies in phase three clinical trials. And we’re right now producing tens of millions of doses. So the fact that you continue to undermine public confidence in a vaccine, if the vaccine emerges during the Trump administration, I think is unconscionable. And Senator, I just ask you, stop playing politics with people’s lives. The reality is that we will have a vaccine, we believe, before the end of this year. And it will have the capacity to save countless American lives. And your continuous undermining of confidence in a vaccine is just, it’s unacceptable. And let me also say, the reality is, when you talk about failure in this administration, we actually do know what failure looks like in a pandemic."
Mike Pence,15:29,"It was 2009. The Swine flu arrived in the United States. Thankfully, it ended up not being as lethal as the Coronavirus. But before the end of the year, when Joe Biden was Vice President of the United States, not seven and a half million people contracted the Swine flu, 60 million Americans contracted the Swine flu. If the Swine flu had been as lethal as the Coronavirus in 2009 when Joe Biden was Vice President, we would have lost 2 million American lives. His own chief of staff, Ron Klain would say last year that it was pure luck that they did, “Everything possible wrong.” And we learned from that. They left the strategic national stockpile empty. They left an empty and hollow plan, but we still learn from it, and I think the American people, I’m going to say again, can be proud of what we have done. And Senator, please stop undermining confidence in a vaccine."
Susan Page,16:32,"Senator Harris, let me ask you the same question that I asked her Vice President Pence, which is, have you had a conversation or reached an agreement with Vice President Biden about safeguards or procedures when it comes to the issue of presidential disability? And if not, and if you win the election next month, do you think you should? You have two minutes uninterrupted."
Kamala Harris,16:53,"Let me tell you first of all, the day I got the call from Joe Biden, it was actually a Zoom call, asking me to serve with him on this ticket was probably one of the most memorable days of my life. I thought about my mother, who came to the United States at the age of 19, gave birth to me at the age of 25 at Kaiser Hospital in Oakland, California. And the thought that I’d be sitting here right now, I know, would make her proud. And she must be looking down on this. Joe and I were raised in a very similar way. We were raised with values that are about hard work, about the value and the dignity of public service, and about the importance of fighting for the dignity of all people. And I think Joe asked me to serve with him because I have a career that included being elected the first woman District Attorney of San Francisco, where I created models of innovation for law enforcement, in terms of reform of the criminal justice system."
Kamala Harris,17:58,"I was elected the first woman of color, and black woman to be elected Attorney General of the state of California, where I ran the second largest department of justice in the United States. Second only to the United States Department of Justice. And there, I took on everything from transnational criminal organizations, to the big banks that were taking advantage of homeowners, to for-profit colleges that were taking advantage of veterans. And then of course, now I serve in the United States Senate as only the second black woman ever elected to the United States Senate. I serve on the Senate Intelligence Committee where I’ve been in regular receipt of classified information about threats to our nation in hotspots around the world. I’ve traveled the world, I’ve met with our soldiers in war zones. And I think Joe has asked me to serve with him because he knows that we share a purpose, which is about lifting up the American people. And after the four years that we have seen of Donald Trump unifying our country around our common values and principles."
Susan Page,18:58,"Thank you, Senator Harris. Neither President Trump, nor Vice President Biden has released a sort of detailed health information that had become the modern norm until the 2016 election. And in recent days, President Trump’s doctors have given misleading answers, or refused to answer basic questions about his health. And my question to each of you in turn is, is this information voters deserve to know? Vice President Pence, would you like to go first?"
Mike Pence,19:26,"Well, Susan, thank you. And let me say on behalf of the President and the First Lady, how moved we’ve all been by the outpouring of prayers and concern for the President. And I do believe it’s emblematic of the prayers and the concern that have ushered forth for every American impacted by the Coronavirus. But the care of the President received at Walter Reed Hospital, the White House doctors was exceptional. And the transparency that they practiced all along the way will continue. The American people have a right to know about-"
Mike Pence,20:03,"… they will continue. The American people have a right to know about the health and well-being of their president, and we’ll continue to do that. But I’m just extremely grateful and was more than a little moved by the broad and bipartisan support. And Senator, I want to thank you and Joe Biden for your expressions and genuine concern. And I also want to congratulate you, as I did on that phone call, on the historic nature of your nomination."
Kamala Harris,20:29,Thank you.
Mike Pence,20:30,"I never expected to be on this stage four years ago, so I know the feeling, but the reality is we’ve got an election before the American people in the midst of this challenging year and the stakes have never been higher, but I think the choice has never been here."
Susan Page,20:46,"Thank you, Vice President. I want to give Senator Harris a chance to respond to the same question I asked, which is, do voters have a right to know more detailed health information about presidential candidates and especially about presidents, especially when they’re facing some kind of challenge?"
Kamala Harris,21:01,"Absolutely. And that’s why Joe Biden has been so incredibly transparent. And certainly by contrast that the President has not, both in terms of health records, but also let’s look at taxes. We now know because of great investigative journalism that Donald Trump paid $750 in taxes. When I first heard about it, I literally said, “You mean $750,000?” And it was like no, $750. We now know Donald Trump owes and is in debt for $400 million. And just so everyone is clear, when we say in debt, it means you owe money to somebody. And it’d be really good to know who the President of the United States, the commander-in-chief owes money to because the American people have a right to know what is influencing the President’s decisions. And is he making those decisions on the best interest of the American people, of you or self-interest?"
Kamala Harris,22:01,"So, Susan, I’m glad you asked about transparency because it has to be across the board. Joe has been incredibly transparent over many, many years. The one thing we all know about Joe, he puts it all out there. He is honest, he is forthright, but Donald Trump on the other hand has been about covering up everything."
Mike Pence,22:22,"Susan, Susan-"
Susan Page,22:22,"Thank you, Senator Harris. I want to give you a chance to respond, Vice President."
Mike Pence,22:25,"Well, look, I respect the fact that Joe Biden spent 47 years in public life. I respect your public service as well."
Kamala Harris,22:33,Thank you.
Mike Pence,22:33,"The American people have a president who was a businessman, he’s a job creator. Who’s paid tens of millions of dollars in taxes, payroll taxes, property taxes. He’s created tens of thousands of American jobs. And the President said those public reports are not accurate. And the President’s also released literally stacks of financial disclosures the American people can review just as the law allows. But the distinction here is that Joe Biden, 47 years in public service compared to President Donald Trump, who brought all of that experience four years ago-"
Susan Page,23:10,Thank you Vice President-
Mike Pence,23:11,"… and turned this economy around by cutting taxes, rolling back regulations-"
Susan Page,23:15,"Thank you, Vice President Pence-"
Mike Pence,23:16,"… unleashing American energy, fighting for free and fair trade. And all of that’s on the line-"
Susan Page,23:20,Thank you Vice President Pence-
Mike Pence,23:21,… if Joe Biden and Kamala Harris are elected.
Susan Page,23:23,That’s a good segue into our third topic-
Kamala Harris,23:26,That’s a great segue.
