speaker,text,minute_start,minute_end
Kristen Welker,"Good evening, everyone.",,
Kristen Welker,Good evening.,,
Kristen Welker,Thank you so much for being here.,,
Kristen Welker,"It is such an honor for me to moderate this debate tonight, the final debate.",,
Kristen Welker,I want to welcome the first family and the first lady.,,
Kristen Welker,We’re so glad and thankful that you are feeling better.,,
Kristen Welker,"I want to welcome the Biden family, Dr. Jill Biden.",,
Kristen Welker,Thank you all for being here tonight.,,
Kristen Welker,We are so excited.,,
Kristen Welker,We’re looking forward to a really robust discussion.,,
Kristen Welker,"And the only thing I would reiterate are the CPD guidelines that when the candidates are talking, please hold any applause or any other reactions.",,
Kristen Welker,"Except of course, when they walk out, make sure you cheer and loud and applause so that everyone can hear you.",,
Kristen Welker,Thank you for having me.,,
Kristen Welker,This is really the honor of a lifetime.,,
Kristen Welker,I am going to sit down and just get organized and get settled and the show will start very soon.,,
Kristen Welker,Thank you for being here.,,
Kristen Welker,(silence).,,
Kristen Welker,"Good evening from Belmont University in Nashville, Tennessee.",,
Kristen Welker,I’m Kristen Welker of NBC News.,,
Kristen Welker,And I welcome you to the final 2020 presidential debate between President Donald J. Trump and former vice president Joe Biden.,,
Kristen Welker,Tonight’s debate is sponsored by the Commission on Presidential Debates.,,
Kristen Welker,It is conducted under health and safety protocols designed by the Commission’s health security advisor.,,
Kristen Welker,The audience here in the hall has promised to remain silent.,,
Kristen Welker,"No cheers, boos, or other interruptions, except right now, as we welcome to the stage, former vice president Joe Biden and President Donald J. Trump.",,
Donald Trump,How are you doing?,,
Donald Trump,How are you?,,
Kristen Welker,And I do want to say a very good evening to both of you.,,
Kristen Welker,This debate will cover six major topics.,,
Kristen Welker,"At the beginning of each section, each candidate will have two minutes, uninterrupted, to answer my first question.",,
Kristen Welker,The Debate Commission will then turn on their microphone only when it is their turn to answer.,,
Kristen Welker,And the Commission will turn it off exactly when the two minutes have expired.,,
Kristen Welker,"After that, both microphones will remain on.",,
Kristen Welker,"But on behalf of the voters, I’m going to ask you to please speak one at a time.",,
Kristen Welker,The goal is for you to hear each other and for the American people to hear every word of what you both have to say.,,
Kristen Welker,"And so with that, if you’re ready, let’s start.",,
Kristen Welker,And we will begin with the fight against the coronavirus.,,
Kristen Welker,"President Trump, the first question is for you.",,
Kristen Welker,The country is heading into a dangerous new phase.,,
Kristen Welker,"More than 40,000 Americans are in the hospital tonight with COVID, including record numbers here in Tennessee.",,
Kristen Welker,"And since the two of you last shared a stage, 16,000 Americans have died from COVID.",,
Kristen Welker,So please be specific.,,
Kristen Welker,How would you lead the country during this next stage of the coronavirus crisis?,,
Kristen Welker,"Two minutes, uninterrupted.",,
Kristen Welker,… during this next stage of the coronavirus crisis.,,
Kristen Welker,Two minutes uninterrupted.,,
Donald Trump,"So as you know, 2.2 million people modeled out, were expected to die.",,
Donald Trump,We closed up the greatest economy in the world in order to fight this horrible disease that came from China.,,
Donald Trump,It’s a worldwide pandemic.,,
Donald Trump,It’s all over the world.,,
Donald Trump,You see the spikes in Europe and many other places right now.,,
Donald Trump,"If you notice, the mortality rate is down 85%.",,
Donald Trump,The excess mortality rate is way down and much lower than almost any other country.,,
Donald Trump,And we’re fighting it and we’re fighting it hard.,,
Donald Trump,There is a spike.,,
Donald Trump,There was a spike in Florida and it’s now gone.,,
Donald Trump,There was a very big spike in Texas.,,
Donald Trump,It’s now gone.,,
Donald Trump,There was a very big spike in Arizona.,,
Donald Trump,It’s now gone.,,
Donald Trump,"And there was some spikes and surges and other places, they will soon be gone.",,
Donald Trump,We have a vaccine that’s coming.,,
Donald Trump,It’s ready.,,
Donald Trump,It’s going to be announced within weeks.,,
Donald Trump,And it’s going to be delivered.,,
Donald Trump,"We have Operation Warp Speed, which is the military is going to distribute the vaccine.",,
Donald Trump,"I can tell you from personal experience, I was in the hospital.",,
Donald Trump,I had it and I got better.,,
Donald Trump,"And I will tell you that I had something that they gave me, a therapeutic, I guess they would call it.",,
Donald Trump,"Some people could say it was a cure, but I was in for a short period of time.",,
Donald Trump,And I got better very fast or I wouldn’t be here tonight.,,
Donald Trump,And now they say I’m immune.,,
Donald Trump,"Whether it’s four months or a lifetime, nobody’s been able to say that, but I’m immune.",,
Donald Trump,More and more people are getting better.,,
Donald Trump,We have a problem that’s a worldwide problem.,,
Donald Trump,"This is a worldwide problem, but I’ve been congratulated by the heads of many countries on what we’ve been able to do.",,
Donald Trump,"If you take a look at what we’ve done in terms of goggles and masks and gowns and everything else, and in particular ventilators we’re now making ventilators all over the world, thousands and thousands a month distributing them all over the world.",,
Donald Trump,It will go away.,,
Donald Trump,"And as I say, we’re rounding the turn.",,
Donald Trump,We’re rounding the corner.,,
Donald Trump,It’s going away.,,
Kristen Welker,Okay.,,
Kristen Welker,Former Vice President Biden to you.,,
Kristen Welker,How would you lead the country out of this crisis?,,
Kristen Welker,You have two minutes uninterrupted.,,
Joe Biden,"220,000 Americans dead.",,
Joe Biden,"You hear nothing else I say tonight, hear this.",,
Joe Biden,Anyone who is responsible for not taking control.,,
Joe Biden,"In fact, not saying I take no responsibility initially.",,
Joe Biden,Anyone is responsible for that many deaths should not remain as president of the United States of America.,,
Joe Biden,We’re in a situation where there are a thousand deaths a day now.,,
Joe Biden,A thousand deaths a day.,,
Joe Biden,"And there are over 70,000 new cases per day.",,
Joe Biden,"Compared to what’s going on in Europe as the New England Medical Journal said, they’re starting from a very low rate.",,
Joe Biden,We’re starting from a very high rate.,,
Joe Biden,"The expectation is we’ll have another 200,000 Americans dead between now and the end of the year.",,
Joe Biden,"If we just wore these masks, the president’s own advisors have told him, we can save a 100,000 lives.",,
Joe Biden,"And we’re in a circumstance where the president thus far and still has no plan, no comprehensive plan.",,
Joe Biden,What I would do is make sure we have everyone encouraged to wear a mask all the time.,,
Joe Biden,"I would make sure we move into the direction of rapid testing, investing in rapid testing.",,
Joe Biden,"I would make sure that we set up national standards as to how to open up schools and open up businesses so they can be safe and give them the wherewithal, the financial resources to be able to do that.",,
Joe Biden,"We’re in a situation now where the New England Medical Journal, one of the serious, most serious journals in the whole world said for the first time ever that the way this president has responded to this crisis has been absolutely tragic.",,
Joe Biden,"And so folks, I will take care of this.",,
Joe Biden,I will end this.,,
Joe Biden,I will make sure we have a plan.,,
Kristen Welker,"President Trump, I’d like to follow up with you and your comments.",,
Kristen Welker,"You talked about taking a therapeutic, I assume you’re referencing Regeneron.",,
Kristen Welker,You also said a vaccine will be coming within weeks.,,
Kristen Welker,Is that a guarantee?,,
Donald Trump,"No, it’s not a guarantee, but it will be by the end of the year.",,
Donald Trump,But I think it has a good chance.,,
Donald Trump,"There are two companies, I think within a matter of weeks and it will be distributed very quickly.",,
Kristen Welker,Can you tell us which companies?,,
Donald Trump,Johnson & Johnson is doing very well.,,
Donald Trump,Moderna is doing very well.,,
Donald Trump,Pfizer is doing very well and we have numerous others.,,
Donald Trump,"Then we also have others that we’re working on very closely with other countries, in particular Europe.",,
Kristen Welker,Let me follow up with you and because this is new information.,,
Kristen Welker,You have set a vaccine is coming soon within weeks now.,,
Kristen Welker,"Your own officials say, “It could take well into 2021 at the earliest for enough Americans to get vaccinated.” And even then they say, “The country will be wearing masks and distancing into 2022.” Is your timeline realistic?",,
Donald Trump,"No, I think my timeline is going to be more accurate.",,
Donald Trump,"I don’t know that they’re counting on the military the way I do, but we have our generals lined up, one in particular that’s the head of logistics and this is a very easy distribution for him.",,
Donald Trump,He’s ready to go.,,
Donald Trump,As soon as we have the vaccine and we expect to have a 100 million vials.,,
Donald Trump,"As soon as we have the vaccine, he’s ready to go.",,
Kristen Welker,"Vice President Biden, your reaction.",,
Kristen Welker,And just 40% of Americans say they would definitely agree to take a coronavirus vaccine if it was approved by the government.,,
Kristen Welker,What steps would you take to give Americans confidence in a vaccine if it were approved?,,
Joe Biden,Make sure it’s totally transparent.,,
Joe Biden,"Have the scientists of the world see it, know it, look at it, go through all the processes.",,
Joe Biden,"And by the way, this is the same fellow who told you, “This is going to end by Easter” last time.",,
Joe Biden,"This is the same fellow who told you that, “Don’t worry, we’re going to end this by the summer.” We’re about to go into a dark winter, a dark winter and he has no clear plan.",,
Joe Biden,And there’s no prospect that there’s going to be a vaccine available for the majority of the American people before the middle of next year.,,
Kristen Welker,"President Trump, your reaction.",,
Kristen Welker,"He says, you have no plan.",,
Donald Trump,I don’t think we’re going to have a dark winter at all.,,
Donald Trump,We’re opening up our country.,,
Donald Trump,"We’ve learned and studied and understand the disease, which we didn’t at the beginning.",,
Donald Trump,"When I closed and banned China from coming in heavily infected and then ultimately Europe, but China was in January.",,
Donald Trump,"Months later, he was saying I was xenophobic.",,
Donald Trump,I did it too soon.,,
Donald Trump,"Now he’s saying, “Oh, I should have moved quicker,” but he didn’t move quicker.",,
Donald Trump,"He was months behind me, many months behind me.",,
Donald Trump,"And frankly, he ran the H1N1 swine flu and it was a total disaster.",,
Donald Trump,"Far less lethal, but it was a total disaster.",,
Donald Trump,"Had that had this kind of numbers, 700,000 people would be dead right now, but it was a far less lethal disease.",,
Donald Trump,"Look, his own person who ran that for him, who, as you know, was his chief of staff said, “It was catastrophic.",,
Donald Trump,It was horrible.,,
Donald Trump,We didn’t know what we were doing.” Now he comes up and he tells us how to do this.,,
Donald Trump,"Also, everything that he said about the way every single move that he said we should make, that’s what we’ve done.",,
Donald Trump,We’ve done all of it.,,
Donald Trump,But he was way behind us.,,
Kristen Welker,"Vice President Biden, your response.",,
Joe Biden,"My response is he is xenophobic, but not because he shutdown access from China.",,
Joe Biden,And he did it late after 40 countries had already done that.,,
Joe Biden,"In addition to that, what he did, he made sure that we had 44 people that were in there in China trying to get the Wuhan to determine what exactly the source was.",,
Joe Biden,What did the president say in January?,,
Joe Biden,"He said, ” No.” He said, “He’s being transparent.",,
Joe Biden,The president of China is being transparent.,,
Joe Biden,We owe him a debt of gratitude.,,
Joe Biden,We have to thank him.”,,
Joe Biden,And then what happened was we started talking about using the Defense Act to make sure we go out and get whatever is needed out there to protect people.,,
Joe Biden,"And again, I go back to this.",,
Joe Biden,"He had nothing, he did virtually nothing.",,
Joe Biden,"And then he gets out of the hospital and he talks about, “Oh, don’t worry.",,
Joe Biden,It’s all going to be over soon.” Come on.,,
Joe Biden,There’s not another serious scientist in the world who thinks it’s going to be over soon.,,
Kristen Welker,"President Trump, your reaction?",,
Joe Biden,I didn’t say over soon.,,
Joe Biden,I say we’re learning to live with it.,,
Joe Biden,We have no choice.,,
Joe Biden,We can’t lock ourselves up in a basement like Joe does.,,
Joe Biden,He has the ability to lock himself up.,,
Joe Biden,I don’t know.,,
Joe Biden,"He’s obviously made a lot of money someplace, but he has this thing about living in a basement.",,
Joe Biden,People can’t do that.,,
Joe Biden,By the way I as the president couldn’t do that.,,
Joe Biden,I’d love to put myself in the basement or in a beautiful room in the White House and go away for a year and a half until it disappears.,,
Joe Biden,I can’t do that.,,
Joe Biden,"And Kirsten, every meeting I had, every meeting I had and I’d meet a lot of families, including gold star families and military families.",,
Joe Biden,"Every meeting I had and I had to meet them, I had to.",,
Joe Biden,It would be horrible to have canceled everything.,,
Joe Biden,"I said, “This is dangerous and you catch it.” And I caught it.",,
Joe Biden,I learned a lot.,,
Joe Biden,I learned a lot.,,
Joe Biden,"Great doctors, great hospitals.",,
Joe Biden,And now I recovered.,,
Joe Biden,99.9 of young people recover.,,
Joe Biden,99% of people recover.,,
Joe Biden,We have to recover-,,
Donald Trump,99% of people recover.,,
Donald Trump,We have to recover.,,
Donald Trump,We can’t close up our nation.,,
Donald Trump,"We have to open our school and we can’t close up our nation, or you’re not going to have a nation.",,
Kristen Welker,"And, of course, the CDC has said young people can get sick with COVID-19 and can pass it.",,
Kristen Welker,"Vice President Biden, I want to talk broadly about strategy though.",,
Joe Biden,Can I respond to that?,,
Kristen Welker,"30 seconds, please.",,
Kristen Welker,Then I have a question.,,
Joe Biden,"Number one, he says that we’re learning to live with it.",,
Joe Biden,People are learning to die with it.,,
Joe Biden,You folks home will have an empty chair at the kitchen table this morning.,,
Joe Biden,"That man or wife going to bed tonight and reaching over to try to touch, there out of habit, where their wife or husband was, is gone.",,
Joe Biden,Learning to live with it.,,
Joe Biden,Come on.,,
Joe Biden,"We’re dying with it, because he’s never said.",,
Joe Biden,"See, you said, “It’s dangerous.” When’s the last time?",,
Joe Biden,Is it really dangerous still?,,
Joe Biden,Are we dangerous.,,
Joe Biden,You tell the people it’s dangerous now.,,
Joe Biden,What should they do about the danger?,,
Joe Biden,"And you say, “I take no responsibility.”",,
Kristen Welker,Let me talk about your Tuesday-,,
Donald Trump,Excuse me.,,
Donald Trump,I take full responsibility.,,
Donald Trump,It’s not my fault that it came here.,,
Donald Trump,It’s China’s fault.,,
Donald Trump,And you know what?,,
Donald Trump,It’s not Joe’s fault that it came here either.,,
Donald Trump,It’s China’s fault.,,
Donald Trump,"They kept it from going into the rest of China for the most part, but they didn’t keep it from coming out to the world, including Europe and ourselves.",,
Kristen Welker,Vice President Biden.,,
Joe Biden,"The fact is that when we knew it was coming, when it hit, what happened?",,
Joe Biden,What did the President say?,,
Joe Biden,"He said, “Don’t worry.",,
Joe Biden,It’s going to go away.,,
Joe Biden,It’ll be gone by Easter.,,
Joe Biden,Don’t worry.,,
Joe Biden,Warm weather.,,
Joe Biden,Don’t worry.,,
Joe Biden,"Maybe inject bleach.” He said he was kidding when he said that, but a lot of people thought it was serious.",,
Joe Biden,"A whole range of things the President has said, even today, he thinks we are in control.",,
Joe Biden,"We’re about to lose 200,000 more people.",,
Kristen Welker,President Trump.,,
Donald Trump,"Look, perhaps just to finish this, I was kidding on that, but just to finish this, when I closed he said I shouldn’t have closed.",,
Donald Trump,And that went on for months.,,
Donald Trump,Nancy Pelosi said the same thing.,,
Donald Trump,"She was dancing on the streets in Chinatown, in San Francisco.",,
Donald Trump,"But when I closed, he said, “This is a terrible thing, you xenophobic.” I think he called me racist even, because I was closing it to China.",,
Donald Trump,Now he says I should have closed it earlier.,,
Donald Trump,"Joe, it doesn’t.",,
Joe Biden,I didn’t say either of those things.,,
Donald Trump,You certainly did.,,
Donald Trump,You certainly did.,,
Joe Biden,I talked about his xenophobia in a different context.,,
Joe Biden,It wasn’t about closing the border to Chinese coming to the United States.,,
Kristen Welker,"All right, I want to talk about both of your different strategies to handling this.",,
Donald Trump,"He thought I shouldn’t have closed the border, that’s obvious.",,
Kristen Welker,"Do you want to respond to that quickly, Vice President Biden?",,
Joe Biden,No.,,
Kristen Welker,Okay.,,
Kristen Welker,Let’s talk about your different strategies toward dealing with this.,,
Kristen Welker,Mr. Vice President you suggested you would support new shutdowns if scientists recommended it.,,
Kristen Welker,"What do you say to Americans who are fearful that the cost of shutdowns, the impact on the economy, the higher rates of hunger, depression, domestic, and substance abuse outweighs the risk of exposure to the virus?",,
Joe Biden,"What I would say is, I’m going to shut down the virus, not the country.",,
Joe Biden,"It’s his ineptitude that caused the country to have to shut down in large part, why businesses have gone under, why schools are closed, why so many people have lost their living, and why they’re concerned.",,
Joe Biden,Those other concerns are real.,,
Joe Biden,"That’s why he should have been, instead of in a sand trap at his golf course, he should have been negotiating with Nancy Pelosi and the rest of the Democrats and Republicans about what to do about the acts they were passing for billions of dollars to make sure people had the capacity.",,
Kristen Welker,But you haven’t ruled out more shut downs?,,
Joe Biden,"Oh, well, no.",,
Joe Biden,"I’m not shutting down today, but there are … Look, you need standards.",,
Joe Biden,"The standard is, if you have a reproduction rate in a community that’s above a certain level, everybody says, “Slow up.",,
Joe Biden,More social distancing.,,
Joe Biden,Do not open bars and do not open gymnasiums.,,
Joe Biden,"Do not open until you get this under control, under more control.” But when you do open, give the people the capacity to be able to open and have the capacity to do it safely.",,
Joe Biden,"For example, schools.",,
Joe Biden,"Schools, they need a lot of money to be open.",,
Joe Biden,They need to deal with ventilation systems.,,
Joe Biden,"They need to deal with smaller classes, more teachers, more pods, and he’s refused to support that money, or at least up to now.",,
Kristen Welker,"Let’s talk about schools, President Trump-",,
Donald Trump,"I think we have to respond, if I might.",,
Kristen Welker,Please.,,
Kristen Welker,And then I have a follow-up.,,
Donald Trump,"Thank you, and I appreciate that.",,
Donald Trump,"Look, all he does is talk about shut downs.",,
Donald Trump,But forget about him.,,
Donald Trump,"His Democrat Governors, Cuomo in New York, you look at what’s going on in California, you look at Pennsylvania, North Carolina, Democrats, Democrats all, they’re shut down so tight and they’re dying.",,
Donald Trump,They’re dying.,,
Donald Trump,And he supports all these people.,,
Donald Trump,All he talks about is shut downs.,,
Donald Trump,"No, we’re not going to shut down.",,
Donald Trump,And we have to open our schools.,,
Donald Trump,"And it’s like, as an example, I have a young son, he also tested positive.",,
Donald Trump,"By the time I spoke to the doctor the second time, he was fine.",,
Donald Trump,It just went away.,,
Donald Trump,"Young people, I guess, it’s their immune system.",,
Kristen Welker,"Let me follow up with you, President Trump.",,
Kristen Welker,You’ve demanded schools open in person and insist they can do it safely.,,
Kristen Welker,"But just yesterday, Boston became the latest city to move its public school system entirely online after a coronavirus spike.",,
Kristen Welker,What is your message to parents who worry that sending their children to school will endanger not only their kids but also their teachers and family?,,
Donald Trump,I want to open the schools.,,
Donald Trump,The transmittal rate to the teachers is very small.,,
Donald Trump,But I want to open the schools.,,
Donald Trump,We have to open our country.,,
Donald Trump,We’re not going to have a country.,,
Donald Trump,You can’t do this.,,
Donald Trump,We can’t keep this country closed.,,
Donald Trump,This is a massive country with a massive economy.,,
Donald Trump,People are losing their jobs.,,
Donald Trump,They’re committing suicide.,,
Donald Trump,"There’s depression, alcohol, drugs at a level that nobody’s ever seen before.",,
Donald Trump,"There’s abuse, tremendous abuse.",,
Donald Trump,We have to open our country.,,
Donald Trump,"I’ve said it often, the cure cannot be worse than the problem itself, and that’s what’s happening.",,
Donald Trump,And he wants to close down.,,
Donald Trump,He’ll close down the country if one person in our massive bureaucracy says we should close it down.,,
Kristen Welker,"Vice President Biden, your response.",,
Joe Biden,Simply not true.,,
Joe Biden,We ought to be able to walk and chew gum at the same time.,,
Joe Biden,"We ought to be able to safely open, but they need resources to open?",,
Joe Biden,"You need to be able to, for example, if you’re going to open a business, have social distancing within the business.",,
Joe Biden,"You need to have, if you have a restaurant, you need to have plexiglass dividers so people cannot infect one another.",,
Joe Biden,You need to be in a position where you can take testing rapidly and know whether the person is in fact infected.,,
Joe Biden,You need to be able to trace.,,
Joe Biden,You need to be able to provide all the resources that are needed to do this.,,
Joe Biden,And that is not inconsistent with saying that we’re going to make sure that we’re going to open safely.,,
Joe Biden,"And by the way, all you teachers out there, not that many of you are going to die, so don’t worry about it.",,
Joe Biden,So don’t worry about it.,,
Joe Biden,Come on.,,
Kristen Welker,"President Trump, let me follow up with you quickly.",,
Donald Trump,"By the way, I will say this, If you go and look at what’s happened to New York, it’s a ghost town.",,
Donald Trump,It’s a ghost town.,,
Donald Trump,"And when you talk about plexiglass, these are restaurants that had dying.",,
Donald Trump,These are businesses with no money.,,
Donald Trump,"Putting up plexiglass is unbelievably expensive, and it’s not the answer.",,
Donald Trump,"I mean, you’re going to sit there in a cubicle wrapped around with plastic.",,
Donald Trump,"These are businesses that are dying, Joe.",,
Donald Trump,You can’t do that to people.,,
Donald Trump,You just can’t.,,
Donald Trump,Take a look at New York and what’s happened to my wonderful city.,,
Donald Trump,"For so many years, I loved it.",,
Donald Trump,It was vibrant.,,
Donald Trump,It’s dying.,,
Donald Trump,Everyone’s leaving New York.,,
Kristen Welker,Vice President Biden.,,
Joe Biden,"Take a look at what New York has done in terms of turning the curve down, in terms of the number of people dying.",,
Joe Biden,"And I don’t look at this in terms of the way he does, blue states and red states.",,
Joe Biden,They’re all the United States.,,
Joe Biden,And look at the states that are having such a spike in the coronavirus.,,
Joe Biden,"They’re the red states, they’re the states in the Midwest, they’re the states in the upper Midwest.",,
Joe Biden,That’s where the spike is occurring significantly.,,
Joe Biden,But they’re all Americans.,,
Joe Biden,They’re all Americans.,,
Joe Biden,"And what we have to do is say, wear these masks, number one.",,
Joe Biden,Make sure we get the help that the businesses need.,,
Joe Biden,That money’s already been passed to do that.,,
