speaker,text,minute_start,minute_end
Donald Trump,"Our farmers, our great farmers, because they were targeted.",,
Donald Trump,You never charged them anything.,,
Donald Trump,"Also, I charged them 25% on dumped steel, because they were killing our steel industry.",,
Donald Trump,We were not going to have a steel industry.,,
Kristen Welker,Okay.,,
Donald Trump,And now we have a steel industry.,,
Kristen Welker,Okay.,,
Kristen Welker,"Vice President Biden, your response, please.",,
Joe Biden,"My response is, look, there’s a reason why he’s bringing up all this malarkey.",,
Joe Biden,There’s a reason for it.,,
Joe Biden,He doesn’t want to talk about the substantive issues.,,
Joe Biden,It’s not about his family and my family.,,
Joe Biden,"It’s about your family, and your family’s hurting badly.",,
Joe Biden,"If you’re a middle-class family, you’re getting hurt badly right now.",,
Joe Biden,"You’re sitting at the kitchen table this morning deciding, “Well, we can’t get new tires.",,
Joe Biden,"They’re bald, because we have to wait another month or so.” Or, “Are we going to be able to pay the mortgage?” Or, “Who’s going to tell her she can’t go back to community college?” They’re the decisions you’re making, and the middle-class families like I grew up in Scranton and Claymont, they’re in trouble.",,
Joe Biden,"We should be talking about your families, but that’s the last thing he wants to talk about.",,
Donald Trump,That is a typical statement.,,
Joe Biden,I want to talk about North Korea.,,
Donald Trump,Excuse me.,,
Donald Trump,"Just for one second, please.",,
Kristen Welker,"10 seconds, Mr. President.",,
Kristen Welker,10 seconds.,,
Donald Trump,That’s a typical political statement.,,
Donald Trump,"Let’s get off this China thing, and then he looks, “The family around the table, everything.” Just a typical politician when I see that.",,
Donald Trump,I’m not a typical politician.,,
Kristen Welker,Let’s talk about North Korea now.,,
Donald Trump,That’s why I got elected.,,
Donald Trump,Let’s get off the subject of China.,,
Donald Trump,Let’s talk about sitting around the table.,,
Donald Trump,"Come on, Joe.",,
Donald Trump,You could do better.,,
Kristen Welker,We’re going to talk about North Korea now.,,
Kristen Welker,"President Trump, you’ve met with North Korean leader Kim Jong-un three times.",,
Kristen Welker,You’ve talked about your beautiful letters with him.,,
Kristen Welker,"You’ve touted the fact that there hasn’t been a war or a long range missile test, and yet North Korea recently rolled out its biggest ever intercontinental ballistic missile and continues to develop its nuclear arsenal.",,
Kristen Welker,Do you see that as a betrayal of the relationship you forged.,,
Donald Trump,No.,,
Kristen Welker,Just 30 seconds here because we need to get onto the next topic.,,
Donald Trump,"So when I met with Barack Obama, we sat in the White House, right at the beginning, had a great conversation.",,
Donald Trump,Was supposed to be 15 minutes and it was well over an hour.,,
Donald Trump,"He said, “The biggest problem we have is North Korea.” He indicated we will be in a war with North Korea.",,
Donald Trump,Guess what?,,
Donald Trump,It would be a nuclear war.,,
Donald Trump,And he does have plenty of nuclear capability.,,
Donald Trump,"In the meantime, I have a very good relationship with him.",,
Donald Trump,"Different kind of a guy, but he probably thinks the same thing about me.",,
Donald Trump,We have a different kind of a relationship.,,
Donald Trump,We have a very good relationship and there’s no war.,,
Donald Trump,"And about two months ago, he broke into a certain area.",,
Donald Trump,"They said, “Oh, there’s going to be trouble.” I said, “No, they’re not, because he’s not going to do that.” And I was right.",,
Donald Trump,"Look, instead of being in a war where millions of people, Seoul is 25 miles away, millions and millions, 32 million people.",,
Donald Trump,Millions of people would be dead right now.,,
Donald Trump,We don’t have a war and I have a good relationship.,,
Kristen Welker,"President Trump, that’s 30 seconds.",,
Kristen Welker,Vice President Biden to you.,,
Kristen Welker,North Korea conducted four nuclear tests under the Obama administration.,,
Kristen Welker,Why do you think you would be able to reign in this persistent threatening?,,
Joe Biden,"Because I’d make it clear, which we were making clear to China, they had to be part of the deal, because I made it clear as a spokesperson for the illustration when I went to China that I said, “Why are you moving your missile defense up so close?",,
Joe Biden,Why are you moving more forces here?,,
Joe Biden,"Why are you continue to do military maneuvers with South Korea?” I said, “Because North Korea is a problem, and we’re going to continue to do it so we can control them.",,
Joe Biden,We’re going to make sure we can control them and make sure they can not hurt us.,,
Joe Biden,"And so if you want to do something about it, step up and help.",,
Joe Biden,"If not, it’s going to continue.” What has he done?",,
Joe Biden,He’s legitimized North Korea.,,
Joe Biden,"He’s talked about his good buddy, who’s a thug, a thug.",,
Joe Biden,And he talks about how we’re better off.,,
Joe Biden,"And they have much more capable missiles, able to reach us territory much more easily than they ever did before.",,
Kristen Welker,"Let me follow up with you, Vice President Biden.",,
Kristen Welker,You’ve said you wouldn’t meet with Kim Jong-un without preconditions.,,
Kristen Welker,Are there any conditions under which you would meet with him?,,
Joe Biden,On the condition that he would agree that he would be drawing down his nuclear capacity.,,
Joe Biden,The Korean Peninsula should be a nuclear free zone.,,
Kristen Welker,All right.,,
Kristen Welker,Let’s move on to American families.,,
Donald Trump,Kristen.,,
Kristen Welker,"Very quickly, 10 seconds, President Trump.",,
Donald Trump,They tried to meet with him.,,
Donald Trump,He wouldn’t do it.,,
Donald Trump,He didn’t like Obama.,,
Donald Trump,He didn’t like him.,,
Donald Trump,He wouldn’t do it.,,
Kristen Welker,"Okay, I’ve got to give him a chance to respond to that before we move on.",,
Donald Trump,I know for a fact.,,
Donald Trump,They tried.,,
Donald Trump,We wouldn’t do it.,,
Donald Trump,And that’s okay.,,
Donald Trump,You know what?,,
Donald Trump,"North Korea, we’re not in a war.",,
Donald Trump,We have a good relationship.,,
Donald Trump,People don’t understand.,,
Donald Trump,Having a good relationship with leaders of other countries is a good thing.,,
Kristen Welker,"President Trump, we have to move on, because we have a lot of questions to get to.",,
Kristen Welker,Your response.,,
Joe Biden,"We had a good relationship with Hitler before he, in fact, invaded Europe, the rest of Europe.",,
Joe Biden,Come on.,,
Joe Biden,"The reason he would not meet with President Obama is because President Obama said, “We’re going to talk about denuclearization.",,
Joe Biden,We’re not going to legitimize you and we’re going to continue to push stronger and stronger sanctions on you.” That’s why he wouldn’t meet with us.,,
Kristen Welker,"All right, let’s move on.",,
Donald Trump,And it didn’t happen.,,
Kristen Welker,Let’s move on and talk about American families.,,
Donald Trump,Excuse me.,,
Donald Trump,He left me a mess.,,
Donald Trump,Kristen.,,
Kristen Welker,President Trump.,,
Kristen Welker,Okay,,
Donald Trump,They left me a mess.,,
Donald Trump,"North Korea was a mess, and in fact, if you remember the first two or three months.",,
Donald Trump,It was a very dangerous period in my first three months before we worked things out a little bit.,,
Kristen Welker,Okay.,,
Donald Trump,There was a very day.,,
Donald Trump,"They left us a mess, and Obama would be, I think, the first to say it, was the single biggest problem he thought that our country [crosstalk 00:17:03].",,
Kristen Welker,"Okay, let’s move on to American families and the economy.",,
Kristen Welker,"One of the issues that’s most important to them is healthcare, as you both know.",,
Kristen Welker,"Today, there was a key vote on a new Supreme Court Justice, Amy Coney Barrett, and healthcare is at the center of her confirmation fight.",,
Kristen Welker,Over 20 million Americans get their health insurance through the Affordable Care Act.,,
Kristen Welker,"It’s headed to the Supreme Court and your administration, Mr. President, is advocating for the court to overturn it.",,
Kristen Welker,"If the Supreme Court does overturn that law, there’s 20 million Americans could lose their health insurance almost overnight.",,
Kristen Welker,So what would you do if those people have their health insurance taken away?,,
Kristen Welker,You have two minutes uninterrupted.,,
Donald Trump,"First of all, I’ve already done something that nobody thought was possible.",,
Donald Trump,"Through the legislature, I terminated the individual mandate.",,
Donald Trump,"That is the worst part of Obamacare, as we call it.",,
Donald Trump,"The individual mandate where you have to pay a fortune for the privilege of not having to pay for bad health insurance, I terminated.",,
Donald Trump,It’s gone.,,
Donald Trump,"Now, it’s in court, because Obamacare is no good.",,
Donald Trump,"But then I made a decision, run it as well as you can, to my people, great people, run it as well as you can.",,
Donald Trump,I could have gone the other route and made everybody very unhappy.,,
Donald Trump,They ran it.,,
Donald Trump,Premiums are down.,,
Donald Trump,Everything’s down.,,
Donald Trump,Here’s the problem.,,
Donald Trump,"No matter how well you run it, it’s no good.",,
Donald Trump,What we’d like to do is terminate it.,,
Donald Trump,We have the individual mandate done.,,
Donald Trump,I don’t know that it’s going to work.,,
Donald Trump,"If we don’t win, we will have to run it and we’ll have Obamacare, but it’ll be better run.",,
Donald Trump,"But it no longer is Obamacare, because without the individual mandate, it’s much different.",,
Donald Trump,Pre-existing conditions will always stay.,,
Donald Trump,"What I would like to do is a much better healthcare, much better.",,
Donald Trump,We’ll always protect people with pre-existing.,,
Donald Trump,"So I’d like to terminate Obamacare, come up with a brand new, beautiful healthcare.",,
Donald Trump,"The Democrats will do it, because there’ll be tremendous pressure on them.",,
Donald Trump,And we might even have the House by that time.,,
Donald Trump,And I think we’re going to win the House.,,
Donald Trump,"You’ll see, but I think we’re going to win the House.",,
Donald Trump,"But come up with a better healthcare, always protecting people with pre-existing conditions.",,
Donald Trump,"And one thing very important, we have 180 million people out there that have great private healthcare.",,
Donald Trump,Far more than we’re talking about with Obamacare.,,
Donald Trump,Joe Biden is going to terminate all of those policies.,,
Donald Trump,These are people that love their healthcare.,,
Donald Trump,"People that have been successful, middle-income people, been successful.",,
Donald Trump,"They have 180 million plans, 180 million people, families.",,
Donald Trump,"Under what he wants to do, which will basically be socialized medicine, he won’t even have a choice, they want to terminate 180 million plans.",,
Donald Trump,"We have done an incredible job at healthcare, and we’re going to do even better.",,
Donald Trump,Just you watch.,,
Kristen Welker,Okay.,,
Kristen Welker,"Vice President Biden, yes, this is for you.",,
Kristen Welker,Your healthcare plan calls for building on Obamacare.,,
Kristen Welker,"So my question is, what is your plan if the law is ruled unconstitutional by the Supreme Court?",,
Kristen Welker,You have two minutes uninterrupted.,,
Joe Biden,"What I’m going to do is pass Obamacare with a public option, and become Bidencare.",,
Joe Biden,"The public option is an option that says that if you in fact do not have the wherewithal, if you qualify for Medicaid and you do not have the wherewithal in your state to get Medicaid, you automatically are enrolled, providing competition for insurance companies.",,
Joe Biden,That’s what’s going to happen.,,
Joe Biden,"Secondly, we’re going to make sure we reduce the premiums and reduce drug prices by making sure that there’s competition, that doesn’t exist now, by allowing Medicare to negotiate drug prices with the insurance companies.",,
Joe Biden,"Thirdly, the idea that I want to eliminate private insurance, the reason why I had such a fight with 20 candidates for the nomination was I support private insurance.",,
Joe Biden,That’s why.,,
Joe Biden,"Not one single person with private insurance would lose their insurance under my plan, nor did they under Obamacare.",,
Joe Biden,They did not lose their insurance unless they chose they wanted to go to something else.,,
Joe Biden,"Lastly, we’re going to make sure we’re in a situation that we actually protect pre-existing.",,
Joe Biden,There’s no way he can protect pre-existing conditions.,,
Joe Biden,"None, zero.",,
Joe Biden,You can’t do it in the ether.,,
Joe Biden,He’s been talking about this for a long time.,,
Joe Biden,He’s never come up with a plan.,,
Joe Biden,"I guess we’re going to get the pre-existing condition plan the same time we got the infrastructure plan that we waited for since ’17, ’18, ’19, and 20.",,
Joe Biden,I still have a few more minutes.,,
Joe Biden,I know you’re getting anxious.,,
Joe Biden,"The fact is that he’s already cost the American people, because of his terrible handling of the COVID virus and economic spillover.",,
Joe Biden,"10 million people have lost their private insurance, and he wants to take away 22 million more people who have it under Obamacare and over 110 million people with pre-existing conditions.",,
Joe Biden,"And all the people from COVID are going to have pre-existing conditions, what are they going to do?",,
Kristen Welker,I have a follow-up for you Vice President Biden.,,
Kristen Welker,It relates to something that President Trump said.,,
Kristen Welker,He’s accusing you of wanting socialized medicine.,,
Kristen Welker,"What do you say to people who have concerns that your healthcare plan, which includes a government insurance option, takes-",,
Kristen Welker,"Concerns that your healthcare plan, which includes a government insurance option, takes the country one step closer to a healthcare system run entirely by the government.",,
Kristen Welker,What’s your response to that?,,
Joe Biden,I say it’s ridiculous.,,
Joe Biden,"It’s like saying that the fact that there’s a public option that people can choose, that makes it a socialist plan.",,
Joe Biden,"Look, the difference between the president and I… I think healthcare is not a privilege, it’s a right.",,
Joe Biden,"Everyone should have the right to have affordable healthcare, and I am very proud of my plan.",,
Joe Biden,"It’s gotten endorsed by all the major labor unions, as well as a whole range of other people who, in fact, are concerned in the medical field.",,
Joe Biden,This is something that’s going to save people’s lives.,,
Joe Biden,And this is going to give some people an opportunity to have healthcare for their children.,,
Joe Biden,"How many of you at home are worried and rolling around in bed tonight, wondering what in God’s name you’re going to do if you get sick, because you’ve lost your health insurance and your company’s gone under?",,
Joe Biden,"We have to provide health insurance for people at an affordable rate, and that’s what I do.",,
Kristen Welker,President Trump-,,
Donald Trump,Excuse me.,,
Donald Trump,He was there-,,
Kristen Welker,… your response.,,
Donald Trump,… for 47 years.,,
Donald Trump,He didn’t do it.,,
Donald Trump,He was now there as vice president for eight years.,,
Donald Trump,And it’s not like it was 25 years ago.,,
Donald Trump,"It was three and three quarters… It was just a little while ago, right?",,
Donald Trump,Less than four years ago.,,
Donald Trump,He didn’t do anything.,,
Donald Trump,He didn’t do it.,,
Donald Trump,He wants socialized medicine.,,
Donald Trump,And it’s not that he wants it.,,
Donald Trump,"His vice president, she is more liberal than Bernie Sanders and wants it even more.",,
Donald Trump,Bernie Sanders wants it.,,
Donald Trump,The Democrats want it.,,
Donald Trump,"You’re going to have socialized medicine, just like you want it with fracking.",,
Donald Trump,“We’re not going to have fracking.,,
Donald Trump,We’re going to stop fracking.,,
Donald Trump,"We’re going to stop fracking.” Then he goes to Pennsylvania after he gets a nomination, where he got very lucky to get it.",,
Donald Trump,"And he goes to Pennsylvania, and he says, “Oh, we’re going to have fracking.” And you never ask that question.",,
Donald Trump,"And by the way, so far, I respect very much the way you’re handling this, I have to say.",,
Joe Biden,By the way-,,
Donald Trump,But somebody should ask the question.,,
Joe Biden,You can ask it.,,
Donald Trump,"He goes for a year, there will be no fracking.",,
Kristen Welker,We do have a number-,,
Donald Trump,There will be no petroleum-,,
Kristen Welker,We have a number of topics we’re going to get to.,,
Donald Trump,"No, no.",,
Donald Trump,But that’s a big question.,,
Kristen Welker,We’re going to get to a number of topics-,,
Donald Trump,It’s the same thing with socialized medicine.,,
Joe Biden,I have to respond to healthcare.,,
Kristen Welker,"Vice President, your response please.",,
Joe Biden,"My response is, people deserve to have affordable healthcare, period.",,
Joe Biden,"Period, period, period.",,
Joe Biden,"And the Biden care proposal will in fact provide for that affordable healthcare, lower premiums.",,
Joe Biden,What we’re going to do is going to cost some money.,,
Joe Biden,It’s going to cost over $750 billion over 10 years to do it.,,
Joe Biden,And they’re going to have lower premiums.,,
Joe Biden,"You can buy into the better plans, the cheaper plans, lower your premiums, deal with unexpected billing, and have your drug prices drop significantly.",,
Joe Biden,He keeps talking about it.,,
Joe Biden,He hasn’t done a thing for anybody on healthcare.,,
Joe Biden,Not a thing.,,
Donald Trump,"Kristen, when he says-",,
Kristen Welker,"Very quickly, then I want to talk about what’s happening on Capitol Hill.",,
Donald Trump,"When he says public option, he’s talking about socialized medicine and healthcare.",,
Donald Trump,"When he talks about a public option, he’s talking about destroying your Medicare, totally destroying-",,
Joe Biden,Wrong.,,
Donald Trump,… and destroying your Social Security.,,
Donald Trump,And this whole country will come down.,,
Donald Trump,Bernie Sanders tried it in his state.,,
Joe Biden,Bernie.,,
Donald Trump,He tried it in his state.,,
Donald Trump,His governor was a very liberal governor.,,
Donald Trump,They wanted to make it work.,,
Kristen Welker,Okay.,,
Kristen Welker,Let’s hear-,,
Donald Trump,It was impossible to work.,,
Kristen Welker,Let’s let Vice President Biden respond-,,
Donald Trump,It doesn’t work.,,
Joe Biden,He’s a very confused guy.,,
Joe Biden,He thinks he’s running against somebody else.,,
Joe Biden,He’s running against Joe Biden.,,
Joe Biden,I beat all those other people because I disagreed with them.,,
Joe Biden,"Joe Biden, he’s running against.",,
Joe Biden,"And the idea that we’re in a situation that is going to destroy Medicare… This is the guy that the actuary of Medicare said, “If in fact…” That’s Social Security.",,
Joe Biden,"“If in fact he continues his plan to withhold the tax on Social Security, Social Security will be bankrupt by 2023 with no way to make up for it.” This is the guy who’s tried to cut Medicare.",,
Joe Biden,The idea that Donald Trump is lecturing me on Social Security and Medicare?,,
Joe Biden,Come on.,,
Donald Trump,He tried to get rid of-,,
Kristen Welker,"10 seconds, Mr. President, and then I have to go to another question.",,
Donald Trump,He tried to hurt Social Security years ago.,,
Donald Trump,Years ago.,,
Donald Trump,Go back and look at the records.,,
Donald Trump,He tried to hurt Social Security years ago.,,
Donald Trump,One thing.,,
Donald Trump,But this is the guy-,,
Kristen Welker,All right.,,
Kristen Welker,Let’s move on.,,
Kristen Welker,I’m going to move on.,,
Donald Trump,… that when they announced last week-,,
Kristen Welker,"Mr. President, I have to move on to the next question or else we’re not going to have time to talk about it.",,
Donald Trump,They say the stock market will boom if I’m elected.,,
Donald Trump,"If he’s elected, the stock market will crash.",,
Kristen Welker,Okay.,,
Kristen Welker,Let’s move on to the next question.,,
Donald Trump,The biggest analysts are saying that.,,
Joe Biden,May I respond?,,
Kristen Welker,Very quickly.,,
Joe Biden,"Look, the idea that the stock market is booming is his only measure of what’s happening.",,
Joe Biden,"Where I come from in Scranton and Claymont, the people don’t live off of the stock market.",,
Joe Biden,"Just in the last three years, during this crisis, the billionaires in this country made, according to Wall Street, 700 billion more dollars.",,
Joe Biden,700 billion more dollars.,,
Joe Biden,Because that’s his only measure.,,
Joe Biden,What happens to the ordinary people out there?,,
Joe Biden,What happens to them?,,
Kristen Welker,Let’s talk about what’s happening on Capitol Hill.,,
Donald Trump,"401(k)s. Kristen, 401(k)s are through the roof.",,
Kristen Welker,We’re going to move on.,,
Donald Trump,People’s stock are through the roof.,,
Kristen Welker,All right.,,
Donald Trump,And he doesn’t come from Scranton.,,
Donald Trump,He lived there for a short period of time before he even knew it.,,
Kristen Welker,Okay.,,
Kristen Welker,We’re going to move on to the next question.,,
Donald Trump,And he left.,,
Donald Trump,And the people of Pennsylvania will show you that.,,
Kristen Welker,"Let me move on to my next question, gentlemen.",,
Donald Trump,They understand.,,
Kristen Welker,"As of tonight, more than 12 million people are out of work.",,
Kristen Welker,"And as of tonight, 8 million more Americans have fallen into poverty, and more families are going hungry every day.",,
Kristen Welker,Those hit hardest are women and people of color.,,
Kristen Welker,They see Washington fighting over a relief bill.,,
Kristen Welker,"Mr. President, why haven’t you been able to get them the help they need?",,
Kristen Welker,30 seconds here.,,
Donald Trump,Because Nancy Pelosi doesn’t want to approve it.,,
Donald Trump,I do.,,
Kristen Welker,But you’re the president.,,
Donald Trump,I do.,,
Donald Trump,"But I still have to get, unfortunately… That’s one of the reasons I think we’re going to take over the House, because of her.",,
Donald Trump,Nancy Pelosi doesn’t want to approve anything because she’d love to have some victories on a date called November 3rd.,,
Donald Trump,Nancy Pelosi does not want to approve it.,,
Donald Trump,"We are ready, willing, and able to do something.",,
Donald Trump,"Don’t forget, we’ve already approved three plans.",,
Donald Trump,"And it’s gone through, including the Democrats, in all fairness.",,
Donald Trump,"This one, she doesn’t want.",,
Donald Trump,It’s near the election.,,
Donald Trump,Because she thinks it helps her politically.,,
Donald Trump,I think it hurts her politically.,,
Kristen Welker,"All right, Mr. Vice President-",,
Joe Biden,"By the way, as you know, the Republican leader in the United States Senate said he can’t pass it.",,
Joe Biden,He will be able to pass it.,,
Joe Biden,He does not have Republican votes.,,
Joe Biden,Why isn’t he talking to his Republican friends?,,
Kristen Welker,"Let me follow up with you, Vice President Biden because-",,
Donald Trump,"If we made a deal, the Republicans will pass it.",,
Kristen Welker,Let me ask Vice President Biden a question.,,
Kristen Welker,You are the leader of the Democratic party.,,
Kristen Welker,Why have you not pushed the Democrats to get a deal for the American people?,,
Joe Biden,"I have, and they have pushed it.",,
Joe Biden,"Look, they passed this act all the way back in the beginning of the summer.",,
Joe Biden,It’s not new.,,
Joe Biden,It’s been out there.,,
Joe Biden,This HEROES Act has been sitting there.,,
Joe Biden,And look at what’s happening.,,
Joe Biden,"When I was in charge of the recovery act with $800 billion, I was able to get $145 billion to local communities that have to balance their budgets and states that have to balance their budgets.",,
Joe Biden,"And then they have to fire firefighters, teachers, first responders, law enforcement officers, so they could keep their cities and counties running.",,
Joe Biden,He will not support that.,,
Joe Biden,They have not done a thing for them.,,
Joe Biden,"And Mitch McConnell said, “Let them go bankrupt.",,
Joe Biden,Let them go bankrupt.” Come on.,,
Joe Biden,What’s the matter with these guys?,,
Donald Trump,"The bill that was passed in the House was a bailout of badly run, high crime, Democrat, all run by Democrat cities and states.",,
Donald Trump,"It was a way of getting a lot of money, billions and billions of dollars, to these guys.",,
Donald Trump,It was also a way of getting a lot of money from our people’s pockets to people that come into our country illegally.,,
Donald Trump,We were going to take care of everything for them.,,
Donald Trump,And I’d love to do that.,,
