speaker,text,minute_start,minute_end
Joe Biden,"It’s been out there since the beginning of the summer, and nothing’s happened.",,
Donald Trump,"Kristen, New York has lost more than 40,000 people, 11,000 people in nursing homes.",,
Kristen Welker,"President Trump, what about-",,
Donald Trump,"When you say spike, take a look at what’s happening in Pennsylvania where they’ve had it closed.",,
Donald Trump,"Take a look at what’s happening with your friend in Michigan, where her husband’s the only one allowed to do anything.",,
Donald Trump,It’s been like a prison.,,
Donald Trump,"Now, it was just ruled unconstitutional.",,
Donald Trump,"Take a look at North Carolina, they’re having spikes and they’ve been closed, and they’re getting killed financially.",,
Donald Trump,"We can’t let that happen, Joe.",,
Donald Trump,You can’t let that happen.,,
Donald Trump,We have to open up.,,
Donald Trump,And we understand the disease.,,
Donald Trump,We have to protect our seniors.,,
Donald Trump,We have to protect our elderly.,,
Donald Trump,We have to protect especially our seniors with heart problems and diabetes problems.,,
Donald Trump,And we will protect.,,
Donald Trump,We have the best testing in the world by far.,,
Donald Trump,That’s why we have so many cases.,,
Kristen Welker,Let me follow up with you before we move on to our next section.,,
Kristen Welker,"President Trump, this week, you called Dr. Anthony Fauci, the nation’s best known infectious disease expert “a disaster.” You described him and other medical experts as “idiots.” If you’re not listening to them, who are you listening to?",,
Donald Trump,"I’m listening to all of them, including Anthony.",,
Donald Trump,I get along very well with Anthony.,,
Donald Trump,"… think to all of them, including Anthony.",,
Donald Trump,"I get along very well with Anthony, but he did say, “Don’t wear masks.” He did say, as you know, “This is not going to be a problem.” I think he’s a Democrat, but that’s okay.",,
Donald Trump,"He said, “This is not going to be a problem.",,
Donald Trump,"We are not going to have a problem at all.” When Joe says that I said, Anthony Fauci said, and others, and many others.",,
Donald Trump,"And I’m not knocking him, nobody knew.",,
Donald Trump,"Look, nobody knew what this thing was.",,
Donald Trump,"Nobody knew where it was coming from, what it was.",,
Donald Trump,We’ve learned a lot.,,
Donald Trump,"But Anthony said “Don’t wear masks,” now he wants to wear masks.",,
Donald Trump,"Anthony also said, if you look back, exact words, here’s his exact words.",,
Donald Trump,“This is no problem.,,
Donald Trump,This is going to go away soon.” So he’s allowed to make mistakes.,,
Donald Trump,He happens to be a good person.,,
Kristen Welker,"Vice President Biden, your response quickly, and then we’re going to move on to the next section.",,
Joe Biden,My response is that think about what the President knew in January and didn’t tell the American people.,,
Joe Biden,"He was told this was a serious virus that spread in the air, and it was much worse, much worse, than the flu.",,
Joe Biden,"He went on record and said to one of your colleagues, recorded, that in fact he knew how dangerous it was but he didn’t want to tell us.",,
Joe Biden,He didn’t want to tell us because he didn’t want us to panic.,,
Joe Biden,He didn’t want us… Americans don’t panic.,,
Joe Biden,He panicked.,,
Joe Biden,"But guess what, in the meantime, we find out in the New York Times the other day, that in fact his folks went to Wall Street and said, “This is a really dangerous thing.” And a memo out of that meeting — not from his administration, but from some of the brokers — said, “Sell short, because we’ve got to get moving.",,
Joe Biden,It’s a dangerous problem.”,,
Donald Trump,"Well, this is what I-",,
Kristen Welker,I’m going to give you 30 seconds to respond and then we’re going to move on.,,
Donald Trump,[crosstalk 00:28:34] I don’t know.,,
Donald Trump,Somebody went through Wall Street.,,
Donald Trump,You’re the one that takes all the money from Wall Street.,,
Donald Trump,I don’t take it.,,
Joe Biden,I haven’t-,,
Donald Trump,"Joe, you have raised a lot of money, tremendous amounts of money.",,
Donald Trump,"And every time you raise money deals are made, Joe.",,
Donald Trump,I could raise so much more money.,,
Donald Trump,"As President, and as somebody that knows most of those people, I could call the heads of Wall Street, the heads of every company in America.",,
Donald Trump,I would blow away every record.,,
Donald Trump,But I don’t want to do that because it puts me in a bad position.,,
Donald Trump,And then you bring up Wall Street?,,
Donald Trump,"You shouldn’t be bringing up Wall Street, because you’re the one that takes the money from Wall Street, not me.",,
Donald Trump,I could blow away your records like you wouldn’t believe.,,
Donald Trump,We don’t need money.,,
Donald Trump,We have plenty of money.,,
Donald Trump,"In fact, we beat Hillary Clinton with a tiny fraction of the money that she was able to [crosstalk 00:29:15]",,
Kristen Welker,"All right, gentlemen, we’re going to move on.",,
Donald Trump,Don’t tell me about [crosstalk 00:29:17].,,
Joe Biden,"Average contribution, $43.",,
Kristen Welker,All right.,,
Kristen Welker,"We’re going to move on to our next section, which is national security.",,
Kristen Welker,And I do want to start with the security of our elections and some breaking news from overnight.,,
Kristen Welker,"Just last night, top intelligence officials confirmed again that both Russia and Iran are working to influence this election.",,
Kristen Welker,"Both countries have obtained US voter registration information, these officials say, and Iran sent intimidating messages to Florida voters.",,
Kristen Welker,"This question goes to you, Mr. Vice President.",,
Kristen Welker,What would you do to put an end to this threat?,,
Kristen Welker,"You have two minutes, uninterrupted.",,
Joe Biden,I made it clear and I asked everyone else to take the pledge.,,
Joe Biden,"I made it clear that any country, no matter who it is, that interferes in American elections will pay a price.",,
Joe Biden,They will pay a price.,,
Joe Biden,"And it’s been overwhelmingly clear this election — I won’t even get into the last one — this election, that Russia has been involved, China’s been involved to some degree, and now we learn that Iran is involved.",,
Joe Biden,They will pay a price if I’m elected.,,
Joe Biden,They’re interfering with American sovereignty.,,
Joe Biden,That’s what’s going on right now.,,
Joe Biden,They’re interfering with American sovereignty.,,
Joe Biden,"And to the best of my knowledge, I don’t think the President has said anything to Putin about it.",,
Joe Biden,I don’t think he’s talking to them a lot.,,
Joe Biden,I don’t think he’s said a word.,,
Joe Biden,"I don’t know why he hasn’t said a word to Putin about it, and I don’t know what he has recently said, if anything, to the Iranians.",,
Joe Biden,My guess is he’d probably be more outspoken with regard to the Iranians.,,
Joe Biden,"But the point is this, folks.",,
Joe Biden,We are in a situation where we have foreign countries trying to interfere in the outcome of our election.,,
Joe Biden,"His own National Security Advisor told him that what is happening with his buddy… Well, I shouldn’t… Well, I will.",,
Joe Biden,His buddy Rudy Giuliani.,,
Joe Biden,He’s being used as a Russian pawn.,,
Joe Biden,He’s being fed information that is Russian that is not true.,,
Joe Biden,And then what happens?,,
Joe Biden,Nothing happens.,,
Joe Biden,"And then you find out that everything that’s going on here, about Russia is wanting to make sure that I do not get elected the next President of the United States, because they know I know them, and they know me.",,
Joe Biden,"I don’t understand why this President is unwilling to take on Putin when he’s actually paying bounties to kill American soldiers in Afghanistan, when he’s engaged in activities that are trying to destabilize all of NATO.",,
Joe Biden,"I don’t know why he doesn’t do it, but it’s worth asking the question.",,
Joe Biden,Why isn’t that being done?,,
Joe Biden,"Any country that interferes with us will, in fact, pay a price, because they’re affecting our sovereignty.",,
Kristen Welker,"President Trump, same question to you.",,
Kristen Welker,[crosstalk 00:31:48] Let me ask the question.,,
Kristen Welker,You’re going to have two minutes to respond.,,
Kristen Welker,"For two elections in a row now, there has been substantial interference from foreign adversaries.",,
Kristen Welker,What would you do in your next term to put an end to this?,,
Kristen Welker,"Two minutes, uninterrupted.",,
Donald Trump,"Well, let me respond to the first part, as Joe answered.",,
Donald Trump,"Joe got $3.5 million from Russia and it came through Putin, because he was very friendly with the former mayor of Moscow and it was the mayor of Moscow’s wife.",,
Donald Trump,And you got $3.5 million.,,
Donald Trump,Your family got $3.5 million.,,
Donald Trump,"And someday you’re going to have to explain, why did you get three and a half?",,
Donald Trump,I never got any money from Russia.,,
Donald Trump,I don’t get money from Russia.,,
Donald Trump,"Now, about your thing last night.",,
Donald Trump,I knew all about that.,,
Donald Trump,"And through John — who is John Ratcliffe, who is fantastic, DNI — he said the one thing that’s common to both of them.",,
Donald Trump,"They both want you to lose because there has been nobody tougher to Russia between the sanctions, nobody tougher than me on Russia, between the sanctions, between all of what I’ve done with NATO.",,
Donald Trump,I’ve got the NATO countries to put up an extra $130 billion going to $420 billion a year.,,
Donald Trump,That’s to guard against Russia.,,
Donald Trump,"I sold, while he was selling pillows and sheets, I sold tank busters to Ukraine.",,
Donald Trump,There has been nobody tougher on Russia than Donald Trump.,,
Donald Trump,"And I’ll tell you, they were so bad.",,
Donald Trump,"They took over the submarine port, you remember that very well, during your term, during you and Barack Obama.",,
Donald Trump,They took over a big part of what should have been Ukraine.,,
Donald Trump,You handed it to them.,,
Donald Trump,But you were getting a lot of money from Russia.,,
Donald Trump,"They were paying you a lot of money, and they probably still are.",,
Donald Trump,"But now, with what came out today, it’s even worse.",,
Donald Trump,"All of the emails, the emails, the horrible emails of the kind of money that you were raking in, you and your family.",,
Donald Trump,"And Joe, you were vice-president when some of this was happening, and it should have never happened.",,
Donald Trump,And I think you owe an explanation to the American people.,,
Donald Trump,"Why is it, somebody just had a news conference a little while ago who was essentially supposed to work with you and your family, but what he said was damning.",,
Donald Trump,"And regardless of me, I think you have to clean it up and talk to the American people.",,
Donald Trump,Maybe you can do it right now.,,
Kristen Welker,"Vice-President Biden, you may respond-",,
Joe Biden,[crosstalk 00:01:31].,,
Kristen Welker,… and then I do want to follow up on the election security.,,
Joe Biden,I have not taken a penny from any foreign source ever in my life.,,
Joe Biden,"We learned that this president paid 50 times the tax in China as a secret bank account with China, does business in China, and in fact, is talking about me taking money?",,
Joe Biden,"I have not taken a single penny from any country, whatsoever, ever, number one.",,
Joe Biden,"Number two, this is a president… I have released all of my tax returns, 22 years, go look at them, 22 years of my tax return.",,
Joe Biden,You have not released a single solitary year of your tax return.,,
Joe Biden,What are you hiding?,,
Joe Biden,Why are you unwilling?,,
Joe Biden,The foreign countries are paying you a lot.,,
Joe Biden,Russia’s paying you a lot.,,
Joe Biden,"China’s paying you a lot on your hotels and all your businesses all around the country, all around the world.",,
Joe Biden,And China’s building a new road to a new golf course you have overseas.,,
Joe Biden,"So, what’s going on here?",,
Joe Biden,Release your tax return or stop talking about corruption.,,
Kristen Welker,"President Trump, your response.",,
Donald Trump,"First of all, I called my accountants, underwrote it, I’m going to release them as soon as we can.",,
Donald Trump,I want to do it.,,
Donald Trump,"And it’ll show how successful, how great this company is.",,
Donald Trump,"But much more importantly than that, people were saying $750.",,
Donald Trump,"I asked them a week ago, I said, “What did I pay?” They said, “Sir, you prepaid tens of millions of dollars.” I prepaid my tax, over the last number of years, tens of millions of dollars, I prepaid, because at some point, they think it’s an estimate.",,
Donald Trump,They think I may have to pay tax.,,
Donald Trump,So I already prepaid it.,,
Donald Trump,Nobody told me that.,,
Donald Trump,Nobody told you that.,,
Kristen Welker,Did your accountant tell you [crosstalk 00:03:11]?,,
Donald Trump,Excuse me.,,
Donald Trump,And it wasn’t written.,,
Donald Trump,"Whenever they write this, they keep talking about $750, which I think is a filing fee, but let me just tell you, I prepaid millions and millions of dollars in taxes, number one.",,
Donald Trump,"Number two, I don’t make money from China.",,
Donald Trump,You do.,,
Donald Trump,I don’t make money from Ukraine.,,
Donald Trump,You do.,,
Donald Trump,I don’t make money from Russia.,,
Donald Trump,"You made $3.5 million, Joe, and your son gave you, they even have a statement that we have to give 10% to the big man.",,
Donald Trump,"You’re the big man, I think.",,
Donald Trump,"I don’t know, maybe you’re not, but you’re the big man, I think.",,
Donald Trump,Your son said we have to give 10% to the big men.,,
Donald Trump,"Joe, what’s that all about?",,
Donald Trump,It’s terrible.,,
Kristen Welker,"All right, gentlemen.",,
Kristen Welker,"I want to ask you both some questions about all of this, but…",,
Joe Biden,I have to respond to that.,,
Kristen Welker,I’m going to let you both respond very quickly.,,
Kristen Welker,"You just said you spoke to your accountant about potentially releasing your taxes, did he tell you when you can release them?",,
Kristen Welker,Do you have a deadline for when you’re going to release them to the American people?,,
Donald Trump,As soon as the auditors finish.,,
Donald Trump,"I get treated worse than the tea party got treated, because I have a lot of people in there-",,
Kristen Welker,[crosstalk 00:04:06].,,
Donald Trump,"… deep down in the IRS, they treat me horribly.",,
Donald Trump,"We made a deal, it was all settled until I decide to run for president.",,
Donald Trump,"I get treated very badly by the IRS, very unfairly, but we had a deal all done.",,
Donald Trump,"As soon as we’re completed with the deal, I want to release it, but I have paid millions and millions of dollars and it’s worse than paying.",,
Donald Trump,I paid in advance.,,
Donald Trump,It’s called prepaying your taxes.,,
Donald Trump,I paid [crosstalk 00:04:32].,,
Kristen Welker,Okay.,,
Kristen Welker,I want to ask you both about questions regarding your potential foreign entanglements and questions that have been raised to give you both a chance to talk about this more broadly.,,
Kristen Welker,"Respond very quickly, and then I’ll get to my question.",,
Joe Biden,"Why did he… he’s been saying this for four years, show us, just show us, stop playing around.",,
Joe Biden,You’ve been saying for four years you’re going to release your taxes.,,
Donald Trump,Everybody knows.,,
Joe Biden,"Nobody knows, Mr. President.",,
Joe Biden,"What they do know is you’re not paying your taxes, or you’re paying taxes that are so low, when last time he said, what he paid, he said, I only pay that little because I’m smart.",,
Joe Biden,I know how to game the system.,,
Joe Biden,Come on.,,
Joe Biden,"Come on, folks.",,
Donald Trump,So…,,
Kristen Welker,"[crosstalk 00:05:11] President Trump, and then I want to get to two questions to both of you on this.",,
Joe Biden,Sure.,,
Donald Trump,I was put through a phony witch hunt for three years.,,
Donald Trump,It started before I even got elected.,,
Donald Trump,They spied of my campaign.,,
Donald Trump,No president should ever have to go through what I went through.,,
Donald Trump,"Let me just say this, Mueller and 18 angry Democrats and FBI agents all over the place spent $48 million.",,
Donald Trump,"They went through everything I had, including my tax returns, and they found absolutely no collusion and nothing wrong.",,
Donald Trump,$48 million.,,
Donald Trump,"I guarantee you, if I spent $1 million on you, Joe, I could find plenty wrong because the kind of things-",,
Kristen Welker,All right.,,
Donald Trump,"… that you’ve done and the kind of monies that your family has taken, I mean, your brother made money in Iraq-",,
Kristen Welker,Let me…,,
Donald Trump,… millions of dollars.,,
Donald Trump,"Your other brother made a fortune, and it’s all through you, Joe.",,
Donald Trump,And they say you get some of it.,,
Donald Trump,"And you do live very well, you have houses all over the place.",,
Donald Trump,You live very well.,,
Kristen Welker,"All right, gentlemen.",,
Kristen Welker,Let me just ask some questions about all of this broadly.,,
Kristen Welker,"Vice-President Biden, there have been questions about the work your son has done in China and for a Ukrainian energy company when you were vice-president, in retrospect, was anything about those relationships inappropriate or unethical?",,
Joe Biden,Nothing was unethical.,,
Joe Biden,Here’s what the deal.,,
Joe Biden,With regard to Ukraine.,,
Joe Biden,"We had this whole question about whether or not, because he was on the board, I later learned of Burisma, a company that somehow, I had done something wrong, yet every single solitary person, when he was going through his impeachment, testifying under oath, who work for him, said I did my job impeccably.",,
Joe Biden,"I carried out U.S. policy, not one single solitary thing was out of line, not a single thing, number one.",,
Joe Biden,"Number two, the guy who got in trouble in Ukraine was this guy trying to bribe the Ukrainian government to say something negative about me, which they would not do and did not do because it never ever, ever happened.",,
Joe Biden,"My son has not made money in terms of this thing about, what are you talking about, China.",,
Joe Biden,I have not had… the only guy who made money from China is this guy.,,
Joe Biden,He’s the only one.,,
Joe Biden,Nobody else has made money from China.,,
Kristen Welker,President Trump-,,
Donald Trump,[crosstalk 00:07:25]…,,
Kristen Welker,… let me ask my question to you [crosstalk 00:07:28]…,,
Donald Trump,But could I just one thing?,,
Kristen Welker,Very quickly.,,
Donald Trump,"His son didn’t have a job for a long time, was, sadly, no longer in the military service, I won’t get into that, and he didn’t have a job.",,
Donald Trump,"As soon as he became vice-president, Burisma, not the best reputation in the world, I hear they paid him $183,000 a month, listen to this, $183,000, and they gave him a $3 million upfront payment, and he had no energy experience.",,
Donald Trump,That’s 100% dishonest.,,
Kristen Welker,All right.,,
Kristen Welker,"I’m going to let the vice-president respond to that quickly, and then I need to get to a question to you.",,
Kristen Welker,"Very quickly, Mr.",,
Kristen Welker,Vice-President.,,
Joe Biden,No basis for that.,,
Joe Biden,Everybody investigated that.,,
Joe Biden,No one said anything he did was wrong in Ukraine.,,
Kristen Welker,Okay.,,
Kristen Welker,"President Trump, this is for you.",,
Kristen Welker,"Since you took office, you’ve never divested from your business.",,
Kristen Welker,You’ve personally promoted your properties abroad.,,
Kristen Welker,"A report this week, which was referenced, does indicate that your company has a bank account in China.",,
Kristen Welker,So how can voters know that you don’t have any foreign conflicts of interest?,,
Donald Trump,I have many bank accounts and they’re all listed and they’re all over the place.,,
Donald Trump,"I mean, I was a businessman doing business.",,
Donald Trump,"The bank account you’re referring to, which is, everybody knows about it, it’s listed, the bank account was in 2013.",,
Donald Trump,That’s what it was.,,
Donald Trump,It was opened.,,
Donald Trump,"It was closed in 2015, I believe.",,
Donald Trump,"And then I decided, because I was going to do… I was thinking about doing a deal in China, like millions of other people, I was thinking about it and I decided I’m not going to do it, didn’t like it, I decided not to do it, had an account open and I closed it.",,
Kristen Welker,Okay.,,
Donald Trump,Excuse me.,,
Donald Trump,"And then, unlike him where he’s vice-president and he does business, I then decided to run for president after that.",,
Donald Trump,That was before.,,
Donald Trump,"So I closed it before I even ran for president, let alone became president, big difference.",,
Donald Trump,"He is the vice-president of the United States and his son, his brother, and his other brother are getting rich.",,
Donald Trump,They’re like a vacuum cleaner.,,
Donald Trump,They’re sucking up money [crosstalk 00:09:20].,,
Kristen Welker,Okay.,,
Kristen Welker,"President Trump, thank you.",,
Kristen Welker,We do need to move on.,,
Joe Biden,Not true.,,
Kristen Welker,"I do want to ask you, Vice-President Biden, about China.",,
Kristen Welker,Let’s talk about China more broadly.,,
Kristen Welker,"There have, of course, President Trump has said that they should pay for not being fully transparent in regards to the coronavirus.",,
Kristen Welker,"If you were president, would you make China pay?",,
Kristen Welker,"And please be specific, what would that look like?",,
Joe Biden,"What I’d make China do is play by the international rules, not like he has done.",,
Joe Biden,"He has caused the deficit of the China to go up, not down, with China, up, not down.",,
Joe Biden,"We are making sure that in order to do business in China, you have to give all your intellectual property.",,
Joe Biden,You have to have a partner in China.,,
Joe Biden,"It’s 51%, we would not do that at all, number one.",,
Joe Biden,"Number two, we’re in a situation where China would have to play by the rules internationally as well.",,
Joe Biden,"When I met with Xi and when I was still vice-president, he said we’re setting up air identification zones in the South China Sea.",,
Joe Biden,You can’t fly through them.,,
Joe Biden,I said we’re going to fly through them.,,
Joe Biden,"We just flew B-52, B-1 bombers through it.",,
Joe Biden,We’re not going to pay attention.,,
Joe Biden,They have to play by the rules.,,
Joe Biden,And what’s he do?,,
Joe Biden,"He embraces guys like the thugs, like in North Korea and the Chinese president and Putin and others, and he pokes his finger [inaudible 00:10:36] all of our friends, all of our allies.",,
Joe Biden,"We make up only… we’re 25%, 25% of the world’s economy.",,
Joe Biden,"We need to be having the rest of our friends with us saying to China, “These are the rules.",,
Joe Biden,"You play by them, or you’re going to pay the price for not paying by them economically.”",,
Joe Biden,"That’s the way I will run it, and that’s what we did and upholding steel tariffs and a range of other things when we were president and vice-president.",,
Kristen Welker,All right.,,
Kristen Welker,Let’s talk about North Korea.,,
Donald Trump,"No, no, no.",,
Kristen Welker,Let…,,
Donald Trump,Excuse me.,,
Donald Trump,"No, I have to…",,
Joe Biden,… and Vice President.,,
Kristen Welker,"All right, let’s talk about North Korea-",,
Donald Trump,Excuse me.,,
Donald Trump,"No, I have to respond to that.",,
Kristen Welker,Okay.,,
Kristen Welker,"Very quickly, and then we’re going to move on to North Korea.",,
Donald Trump,His son walked out with a billion and a half dollars from China to …,,
Joe Biden,Not true.,,
Donald Trump,… after spending 10 minutes in office and being in Air Force Two.,,
Donald Trump,Number one.,,
Donald Trump,"Number two, there’s a very strong email talking about your family wanting to make $10 million a year for introductions.",,
Kristen Welker,"President Trump, on China policy-",,
Joe Biden,That’s not true.,,
Kristen Welker,"… though, what specifically-",,
Donald Trump,"No, but wait a minute.",,
Kristen Welker,"What are you going to do, what specifically are you going to do to make China pay?",,
Kristen Welker,You’ve said you’re going to make them pay.,,
Donald Trump,"First of all, China is paying.",,
Donald Trump,They’re paying billions and billions of dollars.,,
Donald Trump,I just gave $28 billion.,,
Kristen Welker,New sanctions?,,
Donald Trump,I just gave $28 billion to our farmers.,,
Joe Biden,Tax payer’s money.,,
Donald Trump,It’s what?,,
Joe Biden,Taxpayer’s money.,,
Joe Biden,Didn’t come from China.,,
Donald Trump,"No, no.",,
Donald Trump,You know who the taxpayer is?,,
Donald Trump,It’s called China.,,
Joe Biden,Not true.,,
Donald Trump,"China pays 28 billion, and you know what they did to pay it, Joe?",,
Donald Trump,"They devalued their currency and they also paid up, and you know got the money?",,
