f001000,2742.000,2744.640,"Well, it’s hard to get any word in with this clown."
f001001,2744.640,2745.760,"Excuse me, this person."
f001002,2745.760,2747.000,"Hey, let me just tell you, Joe-"
f001003,2747.000,2747.640,"No, no."
f001004,2747.640,2748.640,"Mr. President- [crosstalk 00:24:05]"
f001005,2748.640,2749.200,"Three and a half million, Joe."
f001006,2749.200,2750.200,"That is simply not true."
f001007,2750.200,2752.880,"Why did he deserve three and a half million from Moscow?"
f001008,2752.880,2754.200,"Look, here’s the deal."
f001009,2754.200,2757.360,"We want to talk about families and ethics."
f001010,2757.360,2758.960,"I don’t want to do that."
f001011,2758.960,2761.480,"I mean, his family, we could talk about all night."
f001012,2761.480,2762.640,"His family’s already-"
f001013,2762.640,2763.000,"My family-"
f001014,2763.000,2763.800,"No, no- [crosstalk 00:06:20]."
f001015,2763.800,2767.440,"My family lost a fortune by coming down and helping us with governance."
f001016,2767.440,2768.600,"And that’s such a- [crosstalk 00:24:25]"
f001017,2768.600,2769.680,"Mr. President-"
f001018,2769.680,2771.080,"Every single one of them lost a fortune-"
f001019,2771.080,2773.360,"This is not about my family or his family."
f001020,2773.360,2776.160,"It’s about your family, the American people."
f001021,2776.160,2777.880,"[crosstalk 00:24:32] That’s not true."
f001022,2777.880,2781.440,"It doesn’t want to talk about what you need."
f001023,2781.440,2784.160,"You, the American people, it’s about you."
f001024,2784.160,2786.680,"That’s what we’re talking about here."
f001025,2786.680,2786.800,"[crosstalk 00:24:42]"
f001026,2786.800,2788.120,"That’s the end of the segment."
f001027,2788.120,2789.160,"We’re moving on."
f001028,2789.160,2790.520,"He didn’t take that."
f001029,2790.520,2791.240,"Vice President-"
f001030,2791.240,2792.400,"Chris, can I be honest?"
f001031,2792.400,2794.360,"It’s a very important question-"
f001032,2794.360,2797.120,"Try to be honest."
f001033,2797.120,2797.400,"No."
f001034,2797.400,2797.920,"He stood up-"
f001035,2797.920,2799.160,"The answer to the question is no."
f001036,2799.160,2801.040,"… and the threatened Ukraine-"
f001037,2801.040,2801.680,"Sir-"
f001038,2801.680,2803.160,"… with a billion dollars-"
f001039,2803.160,2805.080,"That is absolutely not true."
f001040,2805.080,2805.800,"Stop."
f001041,2805.800,2811.120,"[crosstalk 00:25:02] Gentlemen, I hate to raise my voice, but I- [crosstalk 00:25:05] Why should I be different than the two of you?"
f001042,2811.120,2812.480,"So here’s the deal."
f001043,2812.480,2813.640,"That’s a good point."
f001044,2813.640,2815.960,"We have six segments."
f001045,2815.960,2817.200,"We have ended that segment."
f001046,2817.200,2818.880,"We’re going to go to the next segment."
f001047,2818.880,2822.400,"In that segment, you each are going to have two uninterrupted moments."
f001048,2822.400,2825.920,"In those two interrupted minutes, Mr. President, you can say anything you want."
f001049,2825.920,2830.360,"I’m going to ask a question about race, but if you want to answer about something else, go ahead."
f001050,2830.360,2838.320,"But I think that the country would be better served, if we allowed both people to speak with fewer interruptions."
f001051,2838.320,2839.960,"I’m appealing to you, sir, to do that."
f001052,2839.960,2841.040,"Well, and him too."
f001053,2841.040,2844.560,"Well, frankly, you’ve been doing more interrupting than he has."
f001054,2844.560,2847.120,"Well, that’s all right, but he does plenty."
f001055,2847.120,2848.240,"Well, sir, less than-"
f001056,2848.240,2849.080,"He does plenty."
f001057,2849.080,2849.640,"No, less than you have."
f001058,2849.640,2851.120,"Let’s please continue on."